,headline,category,short_description,date,Subjectivity,Polarity,Content Subjectivity,Content Polarity
1709,WATCH: 60 Seconds of Social Media,TECH,"Oh, it's on! Black Friday is in full swing -- but do you really even need to leave the house anymore? Only 23 percent of Black Friday shopping took place online in 2006. Last year? 40 percent. Hey, why brave the crowds when you can shop in your PJs?",2012-11-25,0.06666666666666667,0.03333333333333333,0.5261904761904763,0.14523809523809522
1710,New York Tech Rising,TECH,Thanksgiving is a time for looking back -- and thinking about the year ahead. So with that in mind -- I wanted to take this time to share some things I'm thankful for in this growing tech city.,2012-11-25,0.45454545454545453,0.13636363636363635,0.0,0.0
1711,How HP's Disastrous Deal Blows A Hole In Consulting,TECH,HP lost $8.8 billion on acquisition gone bad. Are high-priced consultants and accountants like KPMG and Deloitte to blame,2012-11-25,0.8,-0.7,0.6666666666666666,-0.6999999999999998
1712,Gaza Violence Leads Lawmakers To Call For Shuttering Terror Groups On Twitter,TECH,The past week's violence in Gaza has rekindled calls for Twitter to shutter the accounts of U.S.-labeled terror groups such,2012-11-25,0.0,0.0,0.375,-0.125
1713,Watch The Top 9 YouTube Videos Of The Week,TECH,"If you're looking to see the most popular YouTube videos of the week, look no further. Once again, we're bringing you the",2012-11-25,0.5,0.5,0.6333333333333333,0.3666666666666667
1714,Your Data for Black Friday and Cyber Monday Deals,TECH,Consumers who are willing to give brands a peek into their private lives by following them on Twitter or becoming their Facebook fan should be able to use their data in their favor.,2012-11-24,0.43333333333333335,-0.16666666666666666,0.54,0.24
1715,'Gangnam Style' YouTube Views: Psy's Viral Hit Beats Bieber To Become Most-Viewed YouTube Video Ever,TECH,"""We just made a phone call and I talked to him and said 'Hey, so many people asked did you meet Justin Bieber?'"" Psy said",2012-11-24,0.0,0.0,0.5,0.5
1716,"Damian Dinning, Nokia Imaging Chief, To Quit Struggling Phone Maker",TECH,HELSINKI (Reuters) - Nokia's long-time imaging chief Damian Dinning has decided to leave the loss-making cellphone maker,2012-11-24,0.0,0.0,0.0,0.0
1717,Fighting Hurricane Sandy Debris Removal Crooks: There's An App For That,TECH,Officials dealing with the destruction in the U.S. Northeast say one of their biggest headaches is debris-removal fraud committed,2012-11-23,0.0,0.0,0.0,0.0
1718,"Mike Lynch, Autonomy Founder, Says HP Allegations Don't Add Up",TECH,"This is because software companies often bundle products and services such as licenses, installation, training and maintenance",2012-11-23,0.0,0.0,0.5,0.0
1719,Cyber Monday Deals: How To Find The Best Online Sales And Save Some Major Green,TECH,"""That's what retailers want you to do,"" says Dan Olds, who runs Gabriel Consulting Group, a retail trend watching firm. MAXIMISE",2012-11-23,0.3666666666666667,0.28750000000000003,0.4,-0.2
1720,HP Explains How Its Computers Got To Syria,TECH,The letter was a response to a request from the U.S. Securities and Exchange Commission's Office of Global Security Risk,2012-11-23,0.0,0.0,0.0,0.0
1721,Copyright Alert System: How ISPs Will 'Break Your Internet' If They Catch You Pirating,TECH,"The RIAA and MPAA, though, have kept a clause in the initiative that lets them demand personal information about copyright",2012-11-23,0.0,0.0,0.3,0.0
1722,"Apple Black Friday 2012 Sale: Price Chopped On iPads, iPods, Macs And Others Products",TECH,"One of Apple's biggest bargains is on laptops, which, while it won't win any doorbuster prizes, is still a sizable discount",2012-11-23,0.43333333333333335,-0.16666666666666666,0.4,0.8
1723,Annoying Facebook Friends: 7 Reasons Why People Don't 'Like' Your Posts,TECH,Are there people you absolutely can't stand to follow on this digital platform? Sound off in the comments section or tweet,2012-11-23,0.9,-0.8,0.43333333333333335,0.20000000000000004
1724,"QOOQ, French Tablet, Can Help You Prepare Your American Feast",TECH,"Now those who are really serious about food have QOOQ, conveniently pronounced ""cook."" QOOQ founder Jean-Yves Hepp, who made",2012-11-22,0.0,0.0,0.6666666666666666,-0.3333333333333333
1725,Pioneers of Digital: June Cohen and How TED Talks Reached You via Online Video,TECH,"After an impressive career at Stanford and Hotwired, June Cohen from TED sat down with Chris Anderson to discuss the start of an incredible journey towards nearly one billion video views and to talk about how the TED Conference began opening itself ""up to the world.""",2012-11-22,0.0,0.0,0.6472222222222223,0.46111111111111114
1726,Hackers Target Israel: Tens Of Millions Of Cyberattacks Attempted On Government Websites,TECH,"Finance Minister Yuval Steinitz said just one hacking attempt was successful on a site he did not want to name, but it was",2012-11-18,0.0,0.0,0.95,0.75
1727,Many Rural AT&T Customers Still Lack High-Speed Internet Despite Merger Promise,TECH,"As punishment, the FCC required the cable provider to offer the service a year longer than the original requirement, conduct",2012-11-18,0.25,0.25,0.75,0.375
1728,"Anonymous Hacks Israel, Declares 'All Your Base Are Belong To Us'",TECH,"""...[When] the government of Israel publicly threatened to sever all Internet and other telecommunications into and out of",2012-11-17,1.0,-0.8,0.22083333333333333,-0.0625
1729,Appy Holidays! Best 9 Apps For Holiday Shopping,TECH,"We could all use a little help with our gift lists on the go. Instead of asking Siri, look to these apps to navigate your",2012-11-17,0.3,1.0,0.5,-0.1875
1730,"China's Copyright Piracy Problem Isn't As Big As Media Makes It, Says China",TECH,"By Ben Blanchard ""This could only happen because China's intellectual property rights environment sets foreign investors",2012-11-11,0.1,0.0,0.5083333333333333,0.05833333333333333
1731,"Apple, HTC Lawsuit Settled By Agreeing Not To Fight For 1 Whole Decade",TECH,"Late last year, the U.S. International Trade Commission ruled that HTC had infringed upon one of four patents Apple had disputed",2012-11-11,0.4,0.2,0.2222222222222222,-0.09999999999999999
1732,Spotify To Raise $100 Million At $3 Billion Valuation: WSJ,TECH,(Reporting by Himank Sharma in Bangalore) (Reuters) - Spotify is in the middle of a $100 million financing round that could,2012-11-10,0.0,0.0,0.2,-0.1
1733,Killer Fail: How Romney's Broken Orca App Cost Him Thousands Of Votes,TECH,"A few days before the presidential election, Mitt Romney's campaign announced what it hoped would be its secret weapon at",2012-11-10,0.35,-0.45,0.39999999999999997,-0.30000000000000004
1734,Mitt Romney's Project ORCA Failure: Broken ORCA App Cost Him Thousands Of Votes,TECH,It was a perfect storm of technical issues and a confusing training program that rendered ORCA unusable and completely unhelpful,2012-11-10,0.35,-0.3583333333333334,0.475,0.19999999999999998
1735,The Online Funeral,TECH,"Far from being a settled matter, the appropriateness of public displays of grief is now being debated in the context of social media. Some applaud live-tweeting a funeral for extending the circle of participation. Others don't see things this way.",2012-11-10,0.0,0.0,0.3333333333333333,-0.16666666666666669
1736,Watch The Top 9 YouTube Videos Of The Week,TECH,"If you're looking to see the most popular YouTube videos of the week, look no further. Once again, we're bringing you the",2012-11-10,0.5,0.5,0.6333333333333333,0.3666666666666667
1737,Watch The Top 9 YouTube Videos Of The Week,TECH,"If you're looking to see the most popular YouTube videos of the week, look no further. Once again, we're bringing you the",2012-11-04,0.5,0.5,0.6333333333333333,0.3666666666666667
1738,Relying on Twitter During Hurricane #Sandy,TECH,"After my New York City apartment lost power around 8 p.m., my smartphone's data plan suddenly became my only connection with the outside world. Tweets from the community are helpful to get a distributed feel of the situation but they have to be taken with a grain (a byte?) of salt.",2012-11-04,0.0,0.0,0.5011363636363636,0.03409090909090909
1739,Google Casts A Big Shadow On Smaller Web Sites,TECH,"STARTING in February, Jeffrey G. Katz grew increasingly anxious as he watched the steady decline of online traffic to his",2012-11-04,0.3,0.0,0.5333333333333333,-0.02777777777777778
1740,"How Facebook, Twitter Court Political Campaigns",TECH,Social-media companies Facebook Inc. FB -0.14% and Twitter Inc. are trying to turn political advertising into a big business,2012-11-04,0.1,0.0,0.1,0.0
1741,Internet Governance Forum in Azerbaijan to Discuss Global Policy,TECH,"The IGF is a United Nations forum to discuss a wide variety of issues regarding Internet governance. Unlike many U.N. forums, IGF is attended not just by government officials but also by corporations, non-profit groups and scholars interested in how to handle content management on the global Internet.",2012-11-04,0.0,0.0,0.35,0.1625
1742,Will Windows 8 Fly in a Touch-Grounded World?,TECH,"Call me a reductionist, but I believe the consumer is most wanting a desktop experience and a tablet experience, independent of the other.",2012-11-03,0.9,0.8,0.3333333333333333,0.125
1743,"Hurricane Sandy Delivers 'Another Catastrophe' To Verizon's Home, Complicating Network Repairs",TECH,"“It was churning like crazy. You can see the line here,” Chris Levendos, Verizon’s executive director of national operations",2012-11-03,0.0,0.0,0.9,-0.55
1744,"Information Blackout In Lower Manhattan Ends As Lights, Internet Return",TECH,"Olivia Cieri spent most of the work week after Hurricane Sandy volunteering at ABC No Rio, an artists’ collective on Rivington",2012-11-03,0.0,0.0,0.3,0.2
1745,"Twitter Reportedly Wants To Add Filters, Compete With Instagram",TECH,"In the coming months, Twitter plans to update its mobile applications to introduce filters for photos that will allow people",2012-11-03,0.1,0.2,0.0,0.0
1746,Apple's Second Apology To Samsung Is Much Less Snarky,TECH,"The link takes you to a straightforward, if legalese heavy, description of the ruling in favor of Samsung on Oct. 18: At",2012-11-03,0.03333333333333333,-0.08333333333333333,0.4375,0.0875
1747,"AT&T Mobile Charging Effort Falls Flat In Red Hook, Brooklyn",TECH,"Both of her family's cars were destroyed in the flood, and without electricity, her phone is her only connection to the world",2012-11-03,0.0625,-0.0125,1.0,0.0
1748,RIP Nyan Cat: A Musical Tribute by Keyboard Cat,TECH,"Courtesy of What's Trending, YouTube's famous Keyboard Cat pays a chill, musical tribute to Marty the cat -- the inspiration",2012-11-03,0.0,0.0,0.5,0.25
1749,"How Hurricane Sandy Impacted Internet Usage Through Netflix, Skype And More",TECH,Were you on the internet more because of Hurricane Sandy? Did you use services like Skype or Twitter to stay updated? Let,2012-11-03,0.5,0.5,0.5,0.5
1750,When Machines Rule The World,TECH,Stock markets are supposed to be efficient. Rational actors continually process data in a methodical way and spit out the,2012-10-28,0.0,0.0,0.0,0.0
1751,Are eReaders Doomed? How Our Tablet Love Affair Is Putting The eReader In Jeopardy,TECH,"""I don't see any significant improvements in the technology in the past few years,"" says Calvin Shao of Fubon Securities",2012-10-28,0.6,0.5,0.4083333333333334,-0.025000000000000005
1752,Google Event Cancelled Due To Hurricane Sandy,TECH,"In the meantime, find out how to track Hurricane Sandy online (here) with our handy Twitter and Facebook page rundowns. You",2012-10-27,0.375,-0.125,0.9,0.6
1753,Windows 8: Game Over Man!,TECH,"Windows 8, Microsoft's attempt to be more Apple than Apple, is about to shake up my world and the world of serious gamers everywhere.",2012-10-27,0.4,-0.5,0.5833333333333333,0.08333333333333334
1754,Windows 8 Vocabulary Terms You Need To Talk Intelligently About Microsoft's New OS,TECH,"Quickness -- (We cheated on 'Q', sue us.) Microsoft has drastically improved the time it takes to boot up a Windows 8 machine",2012-10-27,0.6772727272727272,0.4681818181818182,0.0,0.0
1755,Watch The Top 9 YouTube Videos Of The Week,TECH,"If you're looking to see the most popular YouTube videos of the week, look no further. Once again, we're bringing you the",2012-10-27,0.5,0.5,0.6333333333333333,0.3666666666666667
1756,"Lee Chong Wei, Malaysian Badminton Player, Wants Fans To Facebook Him To Get Wedding Invites",TECH,The Olympic silver medalist is getting hitched to sweetheart Wong Mew Choo on November 9 and the chosen few will be able,2012-10-27,0.1,0.2,0.3625,0.15
1757,Jailbreaking Tablets Deemed Illegal By The U.S. Copyright Office,TECH,"The updated document (seen here) states the following: The U.S. Copyright Office published a document on Oct. 26, specifying",2012-10-27,0.5,-0.5,0.1,0.0
1758,High-Tech App Powered Halloween Costumes (VIDEO),TECH,Need an easy-to-assemble Halloween costume that'll surely be the talk of the party? There's an app for that!,2012-10-27,0.0,0.0,0.8888888888888888,0.625
1759,"Marissa Mayer Yahoo Comeback Plan Hones In On Technology, Not Media",TECH,TALENT HUNT The new strategy is not without risks: it positions Yahoo squarely against Facebook Inc and Google. It also risks,2012-10-21,0.0,0.0,0.45454545454545453,0.13636363636363635
1760,NY Tech Scene -- Rising (Week of 10/22/12),TECH,"Tech used to mean software, but that's changing rapidly.",2012-10-21,0.0,0.0,0.6875,-0.3125
1761,"Joanna Shields, Facebook Exec In Charge Of Europe, Quits To Join Group Promoting London's Tech Scene",TECH,"(anjuli.davies@thomsonreuters.com; +44 207 542 6670) Her departure will be a blow to Facebook, the world's biggest social",2012-10-21,0.0,0.0,0.06666666666666667,0.03333333333333333
1762,"iPad Mini Event, New Retina MacBooks And Mac Minis, Too: This Week In Apple Rumors",TECH,"Hello, ladies and gentlemen, and welcome to This Week In Apple Rumors, our regular look back at all of the week's unconfirmed",2012-10-21,0.45454545454545453,0.13636363636363635,0.32564102564102565,0.26666666666666666
1763,Inside Foxconn - James Fallows - The Atlantic,TECH,"The current workforce at Foxconn's Longhua site is around 220,000, of whom about one-quarter stay on-site in dormitories",2012-10-20,0.0,0.0,0.4,0.0
1764,Hey Guys: The Internet Knows You're A Dog,TECH,"Here is one obvious fact that was lost on Michael Brutsch, even though he is a computer programmer who should have known better: The Internet knows you are dog, a cat, or a creep.",2012-10-20,0.0,0.0,0.5,0.25
1765,Google Mulls FTC Settlement Over Patents : WSJ,TECH,(Reuters) - Google Inc is considering a settlement with the Federal Trade Commission over potential claims it broke antitrust,2012-10-20,0.0,0.0,1.0,0.0
1766,"Peter Thiel Could Invest In AirBnb, Valuing It At $2.5 Billion",TECH,"Airbnb and a spokesman for Thiel both declined comment Friday afternoon. Details of the investment round, which has not yet",2012-10-20,0.0,0.0,0.4,-0.2
1767,YouTube Networks: An Inside Look At Their Unsavory Business Practices,TECH,"YouTube and its roughly 200 or so networks may be the new ""new media,"" but their way of doing business is very ""old Hollywood",2012-10-20,0.0,0.0,0.3922727272727273,0.07568181818181818
1768,Watch The Top 9 YouTube Videos Of The Week,TECH,"If you're looking to see the most popular YouTube videos of the week, look no further. Once again, we're bringing you the",2012-10-20,0.5,0.5,0.6333333333333333,0.3666666666666667
1769,"iPhone, Samsung Galaxy S3 Blended: New 'Will It Blend' Smashes Smartphones To Smithereens (VIDEO)",TECH,"Most people have a lot of questions when deciding what smart phone to buy, especially when you're choosing between two competing",2012-10-20,0.45454545454545453,0.13636363636363635,0.7142857142857143,0.2380952380952381
1770,"Hey, Apple! Get Off My Tail!",TECH,"It's just the beginning, guys. Every breath you take. Every move you make. Every bond you break, every step you take, Apple will be watching you. Unless you find the well-hidden option, that is.",2012-10-14,0.0,0.0,0.0,0.0
1771,"Linus Torvalds, Linux Creator, Talks Storage Technology, Compares Hard Drives To 'Satan'",TECH,"[Torvalds] says he only uses desktops and laptops that store data and applications on flash memory, the same stuff that holds",2012-10-14,0.5416666666666666,-0.2916666666666667,0.5625,0.0
1773,When The Most Personal Secrets Get Outed On Facebook,TECH,Bobbi Duncan desperately wanted her father not to know she is lesbian. Facebook told him anyway. Read more on WSJ.com,2012-10-14,0.4,0.25,0.75,-0.04999999999999999
1774,"AT&T Allegedly Starts Six-Strikes Anti-Piracy Plan Next Month, Will Block Websites",TECH,A set of leaked internal AT&T training documents obtained by TorrentFreak reveal that the Internet provider will start sending,2012-10-14,0.05,-0.05,0.0,0.0
1775,"YouTube, Remix Culture and Curation",TECH,"Now that YouTube has revealed that curation is core to their strategy of contextualizing video content, and curators will be paid, leaders in the Fair Use and Remix community are taking notice.",2012-10-14,0.0,0.0,0.9,0.7
1776,SNL Takes On iPhone 5 'Problems' In Skit Pitting Tech Bloggers Against Chinese Factory Workers (VIDEO),TECH,"The show's recent ""Tech Talk"" skit assembles a mock talk show where vocal tech bloggers air their grievances about the device",2012-10-14,0.0,0.0,0.25,0.0
1777,Red Bull Stratos YouTube Live Stream Attracts Record Number Of Viewers (UPDATE),TECH,"Take a look at our live blog from the event for photos, videos, tweets and more from the exciting ascent and skydive as they",2012-10-14,0.25,0.06818181818181818,0.6,0.3121212121212121
1778,"iPad Mini Event And Mockups, New Retina MacBook In Tow: This Week In Apple Rumors",TECH,"Hello, ladies and gentlemen, and welcome to This Week In Apple Rumors, our regular look back at all of the week's unconfirmed",2012-10-14,0.45454545454545453,0.13636363636363635,0.32564102564102565,0.26666666666666666
1779,Blueseed Raising Money To Park Ship Full of Startups Near SF,TECH,"""How awesome would it be if there could be an environment that would be dedicated to helping entrepreneurs...grow and scale",2012-10-13,0.47500000000000003,0.22499999999999998,1.0,1.0
1780,ATT iPhone Customers Hit With Massive Data 'Sipping' Bug,TECH,The bug is the result of an IOS 6 problem that connects the phone to the cellular data network whenever the phone is connected to a WiFi signal.,2012-10-13,1.0,0.0,0.0,0.0
1781,Watch The Top 9 YouTube Videos Of The Week,TECH,"If you're looking to see the most popular YouTube videos of the week, look no further. Once again, we're bringing you the",2012-10-13,0.5,0.5,0.6333333333333333,0.3666666666666667
1782,"iPad Maxi, Mini, and Micro: One Size No Longer Fits All!",TECH,I have three flat touch devices on my desk right now. All three pretty much do the same thing. I feel having three of these things should be an extravagance but it's not.,2012-10-13,0.0,0.0,0.39714285714285713,0.14214285714285713
1783,Kindle eBook Refunds: Amazon Says Users Are Entitled To Their Money Back,TECH,"If the court approves the settlements, the publishers will pay for e-book refunds that will be applied automatically to the",2012-10-13,0.0,0.0,0.0,0.0
1784,iPhone 5 Camera Problem Addressed By Apple In Support Document,TECH,"Apple CEO Tim Cook recently published a public apology for the company's half-baked Maps app, which was developed to replace",2012-10-07,0.0,0.0,0.20555555555555557,0.03333333333333333
1785,Machinima Premieres 'Halo 4: Forward Unto Dawn',TECH,"""Halo 4: Forward Unto Dawn"" series is the largest-scale live-action event EVER set in the Halo universe! The show also provides the perfect segue into the the new Halo 4, which will launch just as this series ends on November 6.",2012-10-07,0.0,0.0,0.7272727272727273,0.5681818181818181
1786,The World of 'Makers' Revealed by Wired's Chris Anderson,TECH,Chris Anderson has cemented himself as the premier chronicler of the digital world with the soon to be published new work Makers: The New Industrial Revolution.,2012-10-07,0.0,0.0,0.30303030303030304,0.0909090909090909
1787,"iPad Mini Event Invitations, Video, And Photos: This Week In Apple Rumors",TECH,"Hello, ladies and gentlemen, and welcome to This Week In Apple Rumors, our regular look back at all of the week's unconfirmed",2012-10-07,0.0,0.0,0.32564102564102565,0.26666666666666666
1788,"'OpenDyslexic,' Free Font, Helps People With Dyslexia Read Online",TECH,"The BBC reports that a recent update to Instapaper, an app that allows users save Web pages to read later, included OpenDyslexic",2012-10-07,0.8,0.4,0.125,0.0
1789,"Amazon Once Offered To Buy Netflix For $12 Million, Book Says",TECH,"In late 1990s, Netflix was still a struggling start-up when CEO Reed Hastings flatly rejected Amazon's acquisition offer",2012-10-07,0.0,0.0,0.3625,-0.1625
1790,Watch The Top 9 YouTube Videos Of The Week,TECH,"If you're looking to see the most popular YouTube videos of the week, look no further. Once again, we're bringing you the",2012-10-06,0.5,0.5,0.6333333333333333,0.3666666666666667
1791,ZNGA: Zynga Stock Drops On Weak Pivot To Mobile; Loss Of Casual Gamers Turns Serious,TECH,Monthly-paying players rose to 4.1 million in the second quarter from 3.5 million. That number would have declined had it,2012-10-06,0.7194444444444444,-0.40277777777777785,0.475,0.3
1792,Prediction: Facebook Hits 2 Billion Users in 2014,TECH,"I've crudely plotted Facebook's user growth in an old notebook, ignoring all sorts of factors that I don't know: attrition rate, macroeconomics, tech scalability, global warming, and the number of cat videos on the Internet.",2012-10-06,0.0,0.0,0.39999999999999997,-0.19999999999999998
1793,iPhone 5: It's Morning in Technology Land,TECH,While the iPhone 5 release is a devastating flub for Apple it's a fantastic opportunity for the rest of us.,2012-09-30,0.0,0.0,0.95,-0.3
1794,On China's Internet You Can Insult The Government All You Want (Just Don't Talk About The Censors),TECH,China's apparatus for control of speech on the Internet is perhaps the largest and most robust in the world. However secretive,2012-09-30,0.0,0.0,0.5,0.5
1795,"Nokia, Oracle To Ink Maps Deal: Report",TECH,(Writing by Olivia Oran in New York; Editing by Dale Hudson) (Reuters) - Phone maker Nokia Oyj is expected to announce a,2012-09-30,0.0,0.0,0.42727272727272725,0.018181818181818174
1796,California Law Helps Pave the Way to a Bright Mobile Future,TECH,"As consumers increasingly show a preference for mobile voice and broadband services, American innovators -- many based in California -- are bringing an astounding array of new products and services to market that both anticipate and respond to evolving consumer demand.",2012-09-30,0.46249999999999997,0.35000000000000003,0.48863636363636365,0.3090909090909091
1797,Three Rules for Earning Quality User-Generated Content,TECH,Marketers today face an incredible challenge -- cutting through the clutter to capture the attention of the most highly fragmented audience in history.,2012-09-30,0.0,0.0,0.71,0.24000000000000002
1798,Kindle Paperwhite Review: Amazon's New Kindle Has A Screen That Shines,TECH,"Take a look at how the Kindle Paperwhite compares to the Nook Glowlight (below): It is with good reason, though, that Amazon",2012-09-30,0.45454545454545453,0.13636363636363635,0.6000000000000001,0.7
1799,Formlabs 3D Printer Is A Desktop-Sized Industrial-Grade Device You Can (Almost) Afford,TECH,Want to print yourself a filigreed bracelet? How about an action figure? Or a tiny to-scale model of the Eiffel Tower? All,2012-09-30,0.0,0.0,0.3,0.05
1800,Watch The Top 9 YouTube Videos Of The Week,TECH,"If you're looking to see the most popular YouTube videos of the week, look no further. Once again, we're bringing you the",2012-09-29,0.5,0.5,0.6333333333333333,0.3666666666666667
1801,Why Facebook and YouTube Should Err on the Side of Free Speech,TECH,They do have a right to set limits that exceed speech rules in democratic countries like the U.S. but they also have a solemn responsibility to take their roles seriously and not arbitrarily censor content unless it clearly violates their stated guidelines.,2012-09-29,0.8,0.4,0.5464285714285714,0.0255952380952381
1802,Apple No Longer Saying Its Maps Are 'The Most Powerful',TECH,"Following Apple CEO Tim Cook's candid admission that Apple Maps might not be so great, and his suggestion that users turn",2012-09-29,0.75,0.4,0.5499999999999999,0.4666666666666666
1803,Cyber Attacks On Canadian Firms Could Be Coming From China,TECH,In both cases the Canadian government declined to comment on reports which suggested a Chinese connection. Calgary-based,2012-09-29,0.0,0.0,0.0,0.0
1804,"Do What You Love, But Don't Get Sick",TECH,I talked to quite a few independent artists who told me about how hard it has been to pay out-of-pocket for health insurance. One artist I love told me his wife's Urinary Tract Infection (UTI) counted as a pre-existing condition and makes their payment outrageously expensive.,2012-09-23,0.7285714285714285,-0.10714285714285715,0.4133333333333333,-0.09833333333333334
1805,"Data Centers Waste Vast Amounts Of Energy, Belying Industry Image",TECH,"Most data centers, by design, consume vast amounts of energy in an incongruously wasteful manner, interviews and documents",2012-09-23,0.5,-0.1,0.75,0.25
1806,Iran Blocks Google As It Prepares To Launch Its Own Internet,TECH,Iranians commonly overcome the government filter by using virtual private network (VPN) software that makes the computer,2012-09-23,1.0,0.6,0.4375,-0.15
1807,Don't Be Rude: 6 Helpful Apps To Make You A Better Person,TECH,"Most of the time, my phone makes me rude. I’ll break eye contact to send a text, leave conversations to snap a photo, or",2012-09-23,0.55,0.1,0.55,0.1
