,headline,category,short_description,date,Subjectivity,Polarity,Content Subjectivity,Content Polarity
539,Microsoft And Amazon Have A Plan For Driverless Cars,TECH,They're making moves.,2016-04-01,0.0,0.0,0.0,0.0
540,The Government Just Made It Cheaper For Some People To Use The Internet,TECH,It's still not enough to overcome deep inequalities.,2016-04-01,0.0,0.0,0.45,0.0
541,Smartphone Growth Could Be Lowest Ever In 2016,TECH,Sales are expected to be flat in China and North America.,2016-03-31,0.0,0.0,0.2625,-0.0625
542,Driverless Cars Flummoxed By America's Shoddy Road Infrastructure,TECH,Bad roads could pose serious problems for autonomous vehicles.,2016-03-31,0.5,-0.3,0.6777777777777777,-0.21111111111111105
543,Now You Can Order Condoms With The Push Of A Button,TECH,"Thanks, Amazon",2016-03-31,0.0,0.0,0.2,0.2
544,Nintendo's New Smartphone Game Is A Trippy Dollhouse,TECH,It's pretty weird.,2016-03-31,0.42727272727272725,-0.13181818181818183,1.0,-0.125
545,"Microsoft's Chat Bot Re-Activates, Immediately Launches Spam Attack",TECH,Tay is at it again.,2016-03-30,0.0,0.0,0.0,0.0
546,FBI Might Withhold Secret Method Of Unlocking iPhone From Apple,TECH,Apple has said it would like the government to share how it cracked the iPhone security protections.,2016-03-30,0.7,-0.4,0.0,0.0
547,"Society Needs To Decide Where Tech Is Taking Us, Microsoft CEO Says",TECH,"""We have these profound questions and issues in front of us.""",2016-03-30,0.0,0.0,1.0,0.08333333333333333
548,Hackers Breach Computer Networks Of Some Big U.S. Law Firms: Report,TECH,Federal investigators are looking to see if confidential information was stolen for insider trading.,2016-03-30,0.1,0.0,0.0,0.0
549,Thousands Are Watching A Virtual Deer Run Amok In 'Grand Theft Auto V',TECH,You need to see it to believe it.,2016-03-30,1.0,0.5,0.0,0.0
550,"For Poor Americans, Getting Online Is About More Than Just Cheap Internet",TECH,The government has a plan to offer subsidized Internet access. But experts say that's not enough.,2016-03-29,0.6,0.16666666666666666,0.5,0.0
551,Microsoft Unveils Next Best Thing To Teleportation,TECH,"With some specialized headsets and cameras, it's now possible to beam someone's 3D image to another location in real time.",2016-03-28,0.15,0.5,0.65,0.1
552,Critics Absolutely Love The Oculus Rift,TECH,But some say it's way too expensive.,2016-03-28,0.6,0.5,0.7,-0.5
553,iOS 9.3 Link Glitch Is Ruining Some iPhones,TECH,People are not pleased.,2016-03-28,0.0,0.0,1.0,-0.25
554,Don't Fall For This Bogus Instagram Ploy,TECH,You're about to see it everywhere.,2016-03-28,0.0,0.0,0.0,0.0
555,DOJ Says It Hacked Into Encrypted iPhone -- Without Apple's Help,TECH,The Feds withdrew legal action that would have forced Apple to help crack open an iPhone from the San Bernardino shooting.,2016-03-28,0.0,0.0,0.25,0.0
556,Facebook Safety Check For Pakistan Bombing Accidentally Goes Worldwide,TECH,Even users thousands of miles from Lahore received the notification.,2016-03-27,0.0,0.0,0.0,0.0
557,Apple Could Withdraw Help In Drug Case If FBI Hacks iPhone,TECH,The standoff continues.,2016-03-25,0.0,0.0,0.0,0.0
558,How To Make Rush Hour Less Deadly And Terrible,TECH,We can make it better. We have the technology.,2016-03-25,0.48888888888888893,-0.45555555555555555,0.5,0.5
559,Interactive Maps Show You What Cities Sound Like,TECH,How does your city sound?,2016-03-25,0.4,0.4,0.4,0.4
560,"One App You Need If You Want The New, Cheap iPhone",TECH,This will make your life easier.,2016-03-25,0.5772727272727273,0.2681818181818182,0.0,0.0
561,Netflix Admits Throttling Video On AT&T And Verizon Phones,TECH,AT&T and Verizon were recently taking heat over their quality of Netflix videos. Now it looks like blame may lie somewhere else.,2016-03-25,0.0,0.0,0.25,0.0
562,Bad Robot: State Wants To Ban Drones From Harassing Wildlife,TECH,Pennsylvania is set to consider a ban on drones in the skies above all 1.5 million acres of state game lands following several,2016-03-24,0.3833333333333333,-0.24999999999999992,0.15,-0.1
563,Feds Say They're Close To Cracking iPhone Without Apple's Help,TECH,The Attorney General said she's hopeful Feds can unlock the iPhone.,2016-03-24,0.0,0.0,0.5,0.05000000000000002
564,'Phubbing' is ruining American relationships,TECH,"In theory, when you’re in a relationship, the temptation to seek emotional relief from isolation through your phone should",2016-03-24,0.0,0.0,0.65,0.0
565,"Microsoft Chat Bot Goes On Racist, Genocidal Twitter Rampage",TECH,Seriously? Seriously.,2016-03-24,0.0,0.0,0.6666666666666666,-0.3333333333333333
566,Hedge Fund To Launch Proxy Fight To Remove Yahoo's Entire Board: Report,TECH,"""The board and management have continually failed to live up to their own promises and shouldn't be trusted with the decision on whether Yahoo should remain an independent company.""",2016-03-24,0.625,0.0,0.48125,0.05909090909090908
567,The new iPhone is an incredible value,TECH,Apple is known for making expensive products that are out of reach for much of the world.,2016-03-23,0.6772727272727272,0.5181818181818182,0.44999999999999996,-0.15
568,Do You Have An Online Impersonator? Facebook Tests New Anti-Imposter Security Feature,TECH,Most users of the social network will now be automatically alerted if a copycat account is detected.,2016-03-23,0.45454545454545453,0.13636363636363635,0.2833333333333333,0.26666666666666666
569,You Should Be Worried If The FBI Can Hack iPhones Without Apple,TECH,"""Everybody's iPhone is now vulnerable.""",2016-03-22,0.0,0.0,0.5,-0.5
570,Are Smartphones 'Over'?,TECH,Apple's new iPhone doesn't exactly wow.,2016-03-22,0.0,0.0,0.7272727272727273,0.11818181818181818
571,"Intel Mastermind, Silicon Valley Statesman Andy Grove Dead At 79",TECH,"""Only the paranoid survive""",2016-03-22,0.4,-0.2,1.0,0.0
572,Tim Cook Swipes At FBI During New iPhone Event,TECH,"""We need to decide as a nation the amount of power the government has on our data and on our privacy.""",2016-03-21,0.45454545454545453,0.13636363636363635,0.0,0.0
573,Apple's New iPhone SE Is Much Cheaper Than Previous Models,TECH,It's much smaller too.,2016-03-21,0.2737373737373737,0.05656565656565657,0.5,0.0
574,Apple Just Solved One Of The iPhone's Most Harmful Features,TECH,Here's how to get the update.,2016-03-21,0.5,0.5,0.0,0.0
575,Behold: Photos Of The New iPhone SE,TECH,"So shiny, so tiny!",2016-03-21,0.45454545454545453,0.13636363636363635,0.5,0.0
576,Man's Mind Is Totally Blown When He Wears VR Headset For The First Time,TECH,Anthony Millward really gets into the virtual reality experience.,2016-03-21,0.5416666666666666,0.125,0.2,0.2
577,Apple's New iPhone SE Is Here,TECH,The next big thing is ... small.,2016-03-21,0.45454545454545453,0.13636363636363635,0.16666666666666666,-0.08333333333333333
578,These First Tweets Will Make You Nostalgic For A More Innocent Age,TECH,Remember when there was such mystery to social media?,2016-03-21,0.6333333333333333,0.1875,0.2833333333333333,0.016666666666666666
579,Watch The Amazing Way Information Spreads On Twitter,TECH,Word travels fast.,2016-03-20,0.9,0.6000000000000001,0.6,0.2
580,'Pray For Me': Pope Francis Joins Instagram,TECH,His message appears in nine different languages.,2016-03-19,0.0,0.0,0.6,0.0
581,How Pirates And Hackers Worked Together To Steal Millions Of Dollars In Diamonds,TECH,"Late on a Friday afternoon in early 2015, Chris Novak got a strange call. As the director of Verizon’s investigative response",2016-03-18,0.0,0.0,0.3499999999999999,-0.08333333333333333
582,This Should Make Uber Drivers Really Nervous,TECH,"Uber has been shopping around for driverless cars, according to an unnamed source.",2016-03-18,0.2,0.2,0.0,0.0
583,Google Is Getting Rid Of Its Creepy Humanoid Robots,TECH,Amazon and Toyota could be potential buyers.,2016-03-17,1.0,-0.5,1.0,0.0
584,Adorable Cookie Monster Apple Ad Gives Us All The Feelings,TECH,Nom nom nom. 🍪,2016-03-17,1.0,0.5,0.0,0.0
585,"Google: $100,000 Says You Can’t Hack A Chromebook Remotely",TECH,"Attention, hackers!",2016-03-17,0.2,-0.1,0.0,0.0
586,Hackers Are Using Expired Domains To Launch Attacks,TECH,Visitors to some major news sites may have been affected.,2016-03-16,0.0,0.0,0.5,0.0625
587,SXSW Held A Ridiculous Gamergate Panel,TECH,"In the world of Gamergate, empathy isn’t allowed, the harassment women face online is exaggerated, and online abuse doesn't",2016-03-16,1.0,-0.3333333333333333,1.0,-0.5
588,These Robots Are So Bad They're Good,TECH,Want a mechanical toothbrush that stabs you in the face?,2016-03-16,0.6333333333333333,5.551115123125783e-17,0.0,0.0
589,"Instagram May Change Your Feed, Personalizing It With An Algorithm",TECH,"For years, we have been trained to view web postings from our friends in a certain order. Refresh the top of your various",2016-03-15,0.0,0.0,0.5238095238095238,0.2380952380952381
590,Former Cyber Czar Says NSA Can Unlock iPhone Terror Data For FBI,TECH,Richard Clarke says the bureau just wants to set a precedent in its pursuit of Apple.,2016-03-15,0.0,0.0,0.1,0.2
591,Surging Demand For Rechargeable Batteries Is Driving Business To South America,TECH,Lithium is an essential component of many consumer tech products.,2016-03-15,0.0,0.0,0.4,0.25
592,Your Sex Toys Could Be Vulnerable To Cyberattack,TECH,Terrifying!,2016-03-15,0.5,-0.5,1.0,-1.0
593,This Device Lets You Test The Air Pollution In Your House,TECH,"And it's free, if you have a library card.",2016-03-15,0.0,0.0,0.8,0.4
594,Apple: DOJ iPhone Request Would 'Appall' U.S. Founders,TECH,This feud is getting intense.,2016-03-15,0.0,0.0,1.0,0.2
595,Is This The iPhone 7?,TECH,Prepare yourself for another heaping portion of Apple rumors.,2016-03-14,0.0,0.0,0.0,0.0
596,Google Is Pressing Feds To Get Driverless Cars On The Road,TECH,Google will make its case before Congress on Tuesday.,2016-03-14,0.0,0.0,0.0,0.0
597,"Facebook, Google and WhatsApp plan to increase encryption of user data",TECH,"Spurred on by Apple’s battles against the FBI, some of tech’s biggest names are to expand encryption of user data in their",2016-03-14,0.0,0.0,0.0,0.0
598,"Smartphones Are Often Ill-Equipped For Mental Health, Safety Emergencies",TECH,"Researchers have said the queries should merit ""special attention"" by tech companies in the future.",2016-03-14,0.2,-0.1,0.3482142857142857,0.17857142857142858
599,This Real Hoverboard Takes A Flying Step Forward,TECH,Too bad they're not planning a consumer model.,2016-03-14,0.30000000000000004,0.2,0.6666666666666666,-0.6999999999999998
600,Pilot Uses GPS Tracker To Draw Picture Of A Plane... With A Plane,TECH,"""Some flights are about the journey -- or in this case, about the image.""",2016-03-14,0.0,0.0,0.0,0.0
601,Human Player Finally Beats Google's AlphaGo AI Program At 'Go',TECH,It was fourth time lucky for Lee Sedol.,2016-03-13,0.55,0.0,0.4166666666666667,0.16666666666666666
602,Facebook's Gun Ban Isn't Working,TECH,An AR-15 semi-automatic rifle. Ammunition for your concealed carry handgun. Your grandfather’s hunting shotgun. Virtually,2016-03-10,0.0,0.0,0.0,0.0
603,How A Hacker's Typo Helped Stop A Billion Dollar Bank Heist,TECH,"The hackers still managed to get away with about $80 million, making it one of the largest known bank thefts in history.",2016-03-10,0.0,0.0,0.0,0.0
604,Cola Messenger Is Like Text Messaging On Steroids,TECH,Because who uses their smartphone to make calls?,2016-03-10,0.0,0.0,0.0,0.0
605,Government Accuses Apple Of 'Deliberately' Boosting Security To Keep Feds Out,TECH,"The Justice Department called Apple's rhetoric ""false.""",2016-03-10,0.0,0.0,0.6,-0.4000000000000001
606,The Government Is Taking A Huge Step On Online Privacy,TECH,Some broadband providers aren't happy about it.,2016-03-10,0.9,0.4000000000000001,1.0,0.8
607,Google's AlphaGo AI Program Defeats One Of World's Best 'Go' Players,TECH,This is huge.,2016-03-09,0.3,1.0,0.9,0.4000000000000001
608,Toyota Introduces Wearable Device For The Blind,TECH,"""Project BLAID"" aims to help improve mobility for the visually impaired.",2016-03-09,0.6666666666666666,-0.5,0.0,0.0
609,You Could Travel To Space As Soon As 2018,TECH,"If you can pay for it, anyway.",2016-03-09,0.0,0.0,0.0,0.0
610,Here's Footage Of Google's Driverless Car Hitting A Bus,TECH,It could've been worse.,2016-03-09,0.0,0.0,0.6,-0.4
611,Yik Yak Introduces Screen Names To Curb Anonymous Trolling,TECH,Will niceness follow?,2016-03-08,0.0,0.0,0.0,0.0
612,Apple Must Clear Another Hurdle In NY Encryption Case,TECH,It's going back to court despite a previous ruling.,2016-03-08,0.3833333333333333,0.10000000000000002,0.08333333333333333,-0.08333333333333333
613,Apple VP: The FBI wants to roll back safeguards that keep us a step ahead of criminals,TECH,Craig Federighi is senior vice president of software engineering at Apple. He first joined Apple in 1997.,2016-03-07,0.05,0.1,0.3333333333333333,0.25
614,Hackers Target Apple Customers With Ransomware Attack,TECH,"Ransomware encrypts data on infected machines, then typically asks users to pay ransoms to get an electronic key so they can retrieve their data.",2016-03-07,0.0,0.0,0.75,-0.08333333333333333
615,Email Trailblazer Raymond Tomlinson Dead At 74,TECH,Tomlinson made the @ symbol one of the most visible characters on the Internet.,2016-03-06,0.4,-0.2,0.5,0.5
616,This T-Shirt Will Let You 'See' Inside The Human Body,TECH,Sort of.,2016-03-05,0.1,0.0,0.0,0.0
617,"Criminals Prefer iPhones Because They're So Secure, Police Say",TECH,"One inmate reportedly called iPhone encryption ""another gift from God.""",2016-03-04,0.6,0.4,0.0,0.0
618,"'Uncharted 4' Director Bruce Straley Talks Diversity, Storytelling Tips And More",TECH,"He discussed the end of ""Uncharted"" in an exclusive interview with HuffPost.",2016-03-04,0.5,0.5,0.0,0.0
619,Apple's Case Just Got Boosted By Some Very Powerful Allies,TECH,Tech companies are taking action against anti-encryption efforts.,2016-03-04,1.0,0.39,0.1,0.1
620,Animal Lovers Will Squeal Over Recent Google Update,TECH,"What does the piggy say, Google?",2016-03-04,0.25,0.0,0.0,0.0
621,Crash Shows Google's Driverless Car Has Room To Improve,TECH,Self-driving cars don't always react quickly to obstacles on the road.,2016-03-04,0.0,0.0,0.0,-0.05
622,YouTube Boosts Female Content Creators With Two New Initiatives,TECH,"As Women's History Month kicks off, YouTube has introduced two initiatives that will call attention to leading female voices",2016-03-03,0.3106060606060606,0.06818181818181818,0.16666666666666666,0.0
623,Amazon Quietly Removes Encryption Support From Its Gadgets,TECH,"While Apple is fighting the FBI in court over encryption, Amazon quietly disabled the option to use encryption to protect",2016-03-03,0.3333333333333333,0.0,0.3,-0.2
624,Google's Driverless Car Division Goes On Hiring Spree,TECH,"It's happening, people!",2016-03-03,0.0,0.0,0.0,0.0
625,Amazon's Got A Few New Tricks To Make Your Home 'Smarter',TECH,"The company just introduced some cool new devices to compliment its popular ""Echo"" speaker.",2016-03-03,0.2772727272727273,-0.03181818181818183,0.6681818181818181,0.3621212121212121
626,"Google, Facebook And Microsoft Will Officially Support Apple In Battle Against FBI",TECH,"These companies, along with several other competitors. are expected to file an amicus brief supporting the tech giant.",2016-03-03,0.0,0.0,0.39305555555555555,0.004166666666666666
627,A New Gadget Frees Spotify From Your Smartphone,TECH,"The ""Mighty"" could transform your listening experience.",2016-03-03,0.45454545454545453,0.13636363636363635,0.9,0.4
628,"Here's What You Need To Know About Apple, FBI Showdown In D.C.",TECH,Lawmakers needled witnesses from both sides.,2016-03-02,0.0,0.0,0.0,0.0
629,You Might Lose Sleep Over This Guy's Facebook Hack,TECH,Zzzzzz---GAH!,2016-03-02,0.0,0.0,0.0,0.0
630,U.S. Military Invites Computer Whizzes To 'Hack The Pentagon',TECH,Such programs allow cyber experts to find and identify problems before malicious hackers can exploit them.,2016-03-02,0.1,-0.1,0.5,0.0
631,McDonald's Is Transforming Sweden's Happy Meals Into VR Headsets,TECH,Smartphones not included.,2016-03-02,1.0,0.8,0.0,0.0
632,"Apple, FBI Take Their Dispute To Congress",TECH,A congressional panel will consider the case on Tuesday.,2016-03-01,0.0,0.0,0.0,0.0
633,The Future Of Voting Could Be A Dystopian Nightmare,TECH,"Believe it or not, you should enjoy this election season while it lasts.",2016-03-01,0.125,0.0,0.5,0.4
634,Reminder: The FBI Doesn't Just Want To Get Inside One Single iPhone,TECH,The San Bernardino case may have ripple effects on many other cases.,2016-03-01,0.21428571428571427,-0.07142857142857142,0.4375,0.1875
635,Judge Denies Government's Request To Unlock iPhone In Drug Case,TECH,Officials originally sought access to the phone back in October.,2016-02-29,0.0,0.0,0.375,0.1875
636,Boy Takes Home Top Prize In Competition For Girls In STEM,TECH,"Pretty Curious, a U.K. program aimed at getting girls interested in STEM careers, asks on its website, “why aren’t more girls",2016-02-29,0.5,0.5,0.75,0.225
637,Europe Wants U.S. Companies Like Google To Play By New Privacy Rules,TECH,European regulators will keep U.S. firms in line with the new rules.,2016-02-29,0.2772727272727273,0.16818181818181818,0.22727272727272727,0.06818181818181818
638,"Unlocking iPhone Would Expose 'Hundreds Of Millions' To Cyber Attacks, Apple Says",TECH,Apple's lawyers will testify in front of lawmakers on Tuesday.,2016-02-29,0.0,0.0,0.0,0.0
639,"UC Berkeley Alerts 80,000 People After Cyber Attack",TECH,A system that stores social security and bank account numbers was hacked.,2016-02-27,0.0,0.0,0.06666666666666667,0.03333333333333333
640,Pokemon Is 20 Years Old! Here's How To Feed Your Pikachu Nostalgia.,TECH,Just because you're 20 years older doesn't mean you can't still enjoy yourself.,2016-02-27,0.2,0.125,0.5069444444444444,0.08472222222222221
641,Apple Might Lock Down iCloud Data To Avoid Another Fight With The Feds,TECH,Just don't forget your passcode.,2016-02-26,0.2888888888888889,-0.15555555555555559,0.0,0.0
642,Rival Phone Makers Reluctant To Support Apple In FBI Battle,TECH,Only one Asian phone company has publicly backed Apple in its fight with FBI.,2016-02-26,0.0,0.0,0.35555555555555557,0.0
643,Apple Is Said To Be Working On An iPhone Even It Can’t Hack,TECH,WASHINGTON — Apple engineers have already begun developing new security measures that would make it impossible for the government,2016-02-25,0.0,0.0,0.7272727272727273,-0.26515151515151514
644,"Bearded Human Bullies Poor, Defenseless Robot",TECH,"Cruel, cruel human.",2016-02-25,0.5,-0.26666666666666666,0.7000000000000001,-0.6666666666666666
645,Apple Submits Brief Opposing U.S. Government's 'Unprecedented' iPhone Request,TECH,The tech giant argued that the government's request violates the company's First Amendment rights.,2016-02-25,0.6166666666666667,0.3,0.6666666666666666,0.125
646,Zuckerberg Furious With Employees For Crossing Out Black Lives Matter Slogans,TECH,"""I now consider this malicious.""",2016-02-25,0.43333333333333335,-0.16666666666666666,0.0,0.0
647,"Apple, the FBI, and Security - Stratechery by Ben Thompson",TECH,To lower the bar when it comes to defense is to give up one of the United States’ biggest strategic advantages.,2016-02-24,0.0,0.0,0.0,0.0
648,Democrats More Likely To Support Apple In Fight For iPhone Privacy,TECH,Support is especially strong among young people.,2016-02-24,0.75,0.25,0.7,0.4833333333333333
649,"Justice Department Just Met With Facebook, Others To Discuss Online Extremism",TECH,"They talked about the use of ""optimistic messaging” to dissuade potential ISIS recruits.",2016-02-24,0.0,0.0,1.0,0.0
650,"Tim Cook: If The FBI Gets What It Wants, It Will Threaten Public Safety",TECH,"Tim Cook said that the government was asking for ""the software equivalent of cancer.""",2016-02-24,0.08333333333333334,0.1,0.0,0.0
651,The Only Site You Need To Check Before Voting,TECH,We all need this.,2016-02-23,1.0,0.0,0.0,0.0
652,Cathedral Moves Sculpture Because Texters Keep Bumping Into It,TECH,"""The Kiss"" has caused quite a few headaches.",2016-02-23,0.0,0.0,0.1,-0.2
653,Scientists Are Working On Prosthetics Controlled By Your Mind,TECH,"Soon, scientists will begin human trials on brain-controlled bionic limbs.",2016-02-23,0.0,0.0,0.1,0.0
654,Artificial Intelligence Is Here To Change Your Life,TECH,The revolution began before you even realized it.,2016-02-23,1.0,-0.6,0.0,0.0
655,How People Can Use Facebook To Track Your Sleep Patterns,TECH,"You get ready for bed, you check Facebook. You wake up, you check Facebook. Both times, and every time, Facebook knows. And",2016-02-22,0.0,0.0,0.5,0.2
656,Apple's Plan To Help Break Standoff With FBI,TECH,The call comes one week after Apple refused to help the FBI unlock an iPhone tied to a terror case.,2016-02-22,0.0,0.0,0.0,0.0
657,Most Americans Don't Support Apple In Its Fight With FBI,TECH,According to two new polls.,2016-02-22,0.5,0.5,0.45454545454545453,0.13636363636363635
658,These Are The Gorgeous New Android Phones You Have To Care About,TECH,The latest devices from Samsung and LG look amazing.,2016-02-22,0.6772727272727272,0.41818181818181815,0.9,0.55
659,Apple Sees Value in Its Stand to Protect Security,TECH,If Apple accedes to American law enforcement demands for opening the iPhone in the San Bernardino case and Beijing asks for,2016-02-21,0.0,0.0,0.0,0.0
660,Your Fears About The Coming Robot Revolution Might Be Overblown,TECH,"People worry they'll steal our jobs, but there's still hope for the future.",2016-02-20,0.0,0.0,0.125,0.0
661,Why Are Digital Assistants Like Siri Given Female Voices?,TECH,"At an artificial intelligence conference, a good question gets a surprising answer.",2016-02-20,0.08333333333333333,0.0,0.7000000000000001,0.26666666666666666
662,Google Sheltered Billions From Taxes In Bermuda Last Year: Report,TECH,By way of the Netherlands.,2016-02-19,0.06666666666666667,0.0,0.0,0.0
663,'Fire Emblem Fates' Will Teach You Harsh Lessons In Life And Death,TECH,If you let it.,2016-02-19,0.7,-0.2,0.0,0.0
664,These Are The Tech Companies Supporting Apple Against The FBI,TECH,"Google, Twitter and WhatsApp are among those opposing  helping the FBI hack into a terrorist's phone.",2016-02-19,0.25,0.25,0.0,0.0
665,"Apple, FBI Battle Escalates As Justice Department Demands San Bernardino Terrorist's iPhone Be Unlocked",TECH,The Justice Department said Apple’s refusal to help unlock the phone was just a marketing strategy.,2016-02-19,0.0,0.0,0.0,0.0
666,"Apple Leads The Charge on Security, But Who Will Follow?",TECH,"After boldly and publicly rejecting a federal court order to hack an iPhone on Wednesday, Apple CEO Tim Cook could reasonably",2016-02-18,0.0,0.0,0.4444444444444444,0.17777777777777778
667,"Los Angeles Hospital Pays Hackers $17,000 Ransom In Bitcoins",TECH,"Paying the ransom was the ""quickest and most efficient way"" of regaining access to the affected systems, the hospital's president said.",2016-02-18,0.0,0.0,0.5,0.5
668,Privacy Activists Rally To Apple's Defense Over FBI Data Demand,TECH,"Google's CEO also warned the request for backdoor access could set a ""troubling precedent.""",2016-02-18,0.0,0.0,0.0,0.0
669,Here's What The FBI Actually Asked Apple To Do,TECH,It's more complicated than it seems.,2016-02-18,0.1,0.0,0.75,0.0
670,San Francisco Entrepreneur Suggests Removing 'Riffraff' As Homeless Solution,TECH,Justin Keller likely doesn't realize that many used to be his neighbors.,2016-02-18,0.0,0.0,0.75,0.25
671,John McAfee Offers To Hack Terrorist's iPhone For FBI,TECH,"Look out, Apple.",2016-02-18,0.0,0.1,0.0,0.0
672,Apple To Fight Order To Break Encryption On San Bernardino Shooter's iPhone,TECH,"""We can find no precedent for an American company being forced to expose its customers to a greater risk of attack.""",2016-02-17,0.0,0.0,0.2333333333333333,0.06666666666666665
673,Apple CEO Tim Cook Takes On The FBI For Threatening Your Data,TECH,The government wants to unlock an iPhone connected to the San Bernardino terror attack.,2016-02-17,0.0,0.0,0.1,0.2
674,Hasbro Doesn't Want Kids To Turn Into iPhone Zombies,TECH,"The ""Star Wars"" toymaker doesn't want kids glued to a screen.",2016-02-16,0.0,0.0,0.0,0.0
675,This Bug Can Completely Disable Your iPhone,TECH,But Apple is working on a fix.,2016-02-15,0.4,0.1,0.0,0.0
676,Marc Andreessen's 'colonialism' gaffe? A symptom of Silicon Valley bias,TECH,"“Why is the Valley suddenly so tone deaf? Well, look how badly the Valley does on inclusion in hiring. Bias is the norm here",2016-02-12,0.0,0.0,0.5833333333333333,-0.3499999999999999
677,How A Couple Found Love On Facebook 'Graffiti' App,TECH,Remember this?,2016-02-12,0.6,0.5,0.0,0.0
678,PSA Tells You To 'Keep It In Your Pants' For Valentine's Day,TECH,Your phone. Keep your PHONE in your pants.,2016-02-12,0.0,0.0,0.0,0.0
679,New App Helps Iranians Dodge 'Morality Police',TECH,"The app is seen as a ""digital protest"" in advance of Iran's upcoming elections.",2016-02-12,0.45454545454545453,0.13636363636363635,0.0,0.0
680,"This Valentine's Day, More Americans Are Searching For Love Online",TECH,Set up your Tinder date now.,2016-02-11,0.55,0.5,0.0,0.0
681,The FBI Could Be Eavesdropping On Your Toaster,TECH,In case you weren't already terrified about your cybersecurity...,2016-02-11,0.0,0.0,0.0,0.0
682,Woman Targeted In 'GamerGate' Harassment Drops Charges,TECH,"Zoe Quinn: ""Trying to get the law to protect me has only continually put me in harm’s way.""",2016-02-11,0.0,0.0,1.0,0.0
683,Google's Self-Driving Cars Just Cleared A Major Roadblock,TECH,Vrroooom.,2016-02-10,0.5,0.0625,0.0,0.0
684,Twitter's New Update Could Bring You Into The Echo Chamber,TECH,"The change means more ""old"" tweets in your timeline.",2016-02-10,0.45454545454545453,0.13636363636363635,0.35,0.3
