,headline,category,short_description,date,Subjectivity,Polarity,Content Subjectivity,Content Polarity
0,"Twitch Bans Gambling Sites After Streamer Scams Folks Out Of $200,000",TECH,One man's claims that he scammed people on the platform caused several popular streamers to consider a Twitch boycott.,2022-09-21,0.0,0.0,0.45,0.3
1,TikTok Search Results Riddled With Misinformation: Report,TECH,A U.S. firm that monitors false online claims reports that searches for information about prominent news topics on TikTok are likely to turn up results riddled with misinformation.,2022-09-14,0.0,0.0,0.75,-0.025000000000000022
2,Citing Imminent Danger Cloudflare Drops Hate Site Kiwi Farms,TECH,Cloudflare CEO Matthew Prince had previously resisted calls to block the site.,2022-09-05,0.9,-0.8,0.16666666666666666,-0.16666666666666666
3,Instagram And Facebook Remove Posts Offering Abortion Pills,TECH,"Facebook and Instagram began removing some of these posts, just as millions across the U.S. were searching for clarity around abortion access.",2022-06-28,0.0,0.0,0.0,0.0
4,Google Engineer On Leave After He Claims AI Program Has Gone Sentient,TECH,"Artificially intelligent chatbot generator LaMDA wants “to be acknowledged as an employee of Google rather than as property,"" says engineer Blake Lemoine.",2022-06-12,0.0,0.0,0.5,0.5
5,Facebook Is Still Allowing Mug Shots Even Though They Can Ruin Lives,TECH,"When an individual’s mug shot goes viral on Facebook, they are often subjected to extreme harassment and struggle to find stable housing and employment.",2022-05-14,0.0,0.0,0.7,-0.0625
6,Ex-Twitter CEO Dings Elon Musk For Attacks On Twitter's Top Lawyer,TECH,A one-sided feud between Musk and Vijaya Gadde has turned even uglier.,2022-04-27,0.5,0.5,0.0,0.0
7,Investor Sues Elon Musk Over His Delayed Twitter Filing,TECH,"Marc Rasella says he sold shares of Twitter at “artificially deflated prices,” unaware that Musk had made a large purchase in the social media platform.",2022-04-12,0.0,0.0,0.4988095238095238,-0.08809523809523809
8,Cyberattacks Accompany Russian Military Assault On Ukraine,TECH,"The websites of Ukraine's defense, foreign and interior ministries were unreachable or painfully slow to load Thursday after a wave of distributed-denial-of-service attacks.",2022-02-24,0.05,-0.05,0.26249999999999996,-0.21250000000000002
9,"Under Pressure, Apple Will Allow Self-Repairs To iPhones, Macs",TECH,The company has long prohibited users to repair their own devices. The shift reflects a strengthening “right to repair” movement.,2021-11-18,0.0,0.0,0.6452380952380952,0.2785714285714285
10,"Pentagon Gives Microsoft $10 Billion 'War Cloud' Deal, Snubbing Amazon",TECH,Early speculation of the giant government defense contract suggested it would go to Amazon.,2019-10-26,0.0,0.0,0.65,0.05
11,Marc Benioff: Facebook Is ‘The New Cigarettes' And Should Probably Be Broken Up,TECH,The billionaire Salesforce CEO denounced the social media company for refusing to take down fake political ads.,2019-10-17,0.42727272727272725,-0.13181818181818183,0.36388888888888893,-0.15555555555555556
12,Uber To Start Banning Riders With Low Ratings,TECH,"“Respect is a two-way street, and so is accountability,” Uber said.",2019-05-29,0.3,0.0,0.0,0.0
13,Facebook Bans White Nationalism And White Separatism Content After Mosque Shootings,TECH,Politicians and civil rights groups praised the policy change but some questioned whether the social media giant had gone far enough.,2019-03-28,0.0,0.0,0.6416666666666666,0.03333333333333333
14,Microsoft Workers Protest Use Of HoloLens Headsets For War,TECH,They say they “refuse to create technology for warfare and oppression.”,2019-02-24,0.0,0.0,0.0,0.0
15,Apple To Pay Teen Who Uncovered FaceTime Eavesdropping Bug,TECH,"14-year-old Grant Thompson's family will be given a financial reward, including money for his education, as a thanks.",2019-02-09,0.0,0.0,0.1,0.1
16,Apple Cracks Down On Apps That Quietly Record Users' Screen Time,TECH,"The decision follows a number of major companies using so-called ""session replay"" to record users' activity.",2019-02-07,0.3111111111111111,-0.07777777777777779,0.5,0.0625
17,Apple Delays FaceTime Update After Eavesdropping Bug Fiasco,TECH,Apple will reportedly issue the software update next week,2019-02-02,0.0,0.0,0.0,0.0
18,FaceTime Users Urged To Disable App Over Eavesdropping Bug,TECH,Apple has announced plans to make a software update available this week to solve the issue.,2019-01-29,0.0,0.0,0.4,0.4
19,Facebook Admits To Targeting Billionaire George Soros In PR Attack,TECH,Facebook CEO Mark Zuckerberg said last week he didn't know about the PR campaign until The New York Times investigation.,2018-11-21,0.0,0.0,0.2606060606060606,0.06818181818181818
20,'Lax' Security At TwitchCon Causes Anxiety In Wake Of Deadly Shooting,TECH,"""It seems like they were prioritizing speed over security,” an attendee said.",2018-10-28,0.4,-0.2,0.0,0.0
21,Elon Musk’s Boring Company To Build High-Speed Transit Network In Chicago,TECH,The goal? Travel from downtown Chicago to O'Hare Airport in 12 minutes flat.,2018-06-14,1.0,-1.0,0.125,-0.025
22,Facebook Accused Of Reading Texts And Accessing Microphones In Lawsuit,TECH,A failed startup suggested that Facebook mounted what could be described as mass surveillance.,2018-05-24,0.0,0.0,0.3,-0.5
23,Self-Driving Uber In Fatal Accident Had 6 Seconds To React Before Crash,TECH,The NTSB published a preliminary report on the incident Thursday.,2018-05-24,0.0,0.0,0.0,0.0
24,Instagram Is Adding A 'Mute' Button For The Sake Of Your Sanity,TECH,And no one will know when you use it.,2018-05-22,0.0,0.0,0.0,0.0
25,Cambridge Analytica Files For Chapter 7 Bankruptcy After Facebook Privacy Row,TECH,The firm at the center of the Facebook data hack made the decision after suffering a sharp drop in business.,2018-05-18,0.0,0.0,0.4166666666666667,-0.1416666666666667
26,Why Isn't There A Birth Control Emoji?,TECH,Two women decided it was time to have one.,2018-05-16,0.0,0.0,0.0,0.0
27,Facebook Removed More Than 500 Million Fake Accounts In First Quarter Of 2018,TECH,"Facebook's first community standards enforcement report shows the company is ""trying to be as open as we can,” an executive said.",2018-05-16,0.611111111111111,0.08333333333333333,0.41666666666666663,0.125
28,"Tesla Autopilot Was Engaged During Horrific 60 MPH Crash, Driver Tells Police",TECH,Tesla CEO Elon Musk tweeted that it's amazing the driver wasn't more seriously injured.,2018-05-15,1.0,-1.0,0.6888888888888888,0.2555555555555556
29,Facebook Suspends 200 Apps Amid Data Misuse Investigation,TECH,The investigation was launched in response to the Cambridge Analytica scandal.,2018-05-14,0.0,0.0,0.0,0.0
30,Keyless Cars Have Killed More Than 2 Dozen People Since 2006: Report,TECH,Drivers have succumbed to carbon monoxide poisoning after forgetting to turn off a vehicle in their garage.,2018-05-14,0.25,0.15,0.0,0.0
31,Possible Autopilot Use Probed After Tesla Crashes At 60 MPH,TECH,It's not yet known if the autopilot was engaged. The car's driver suffered a broken ankle.,2018-05-13,1.0,0.0,0.4,-0.4
32,Boston Dynamics' 'Robot Dog' May Be Available For Sale Soon,TECH,"Super cool, or bone chilling?",2018-05-12,0.4,0.4,0.7388888888888889,0.061111111111111116
33,Jet Just Launched Its Own Apple Store With Some Incredible Deals,TECH,"If you’re on a time crunch to find a perfect Mother’s Day gift that’ll still arrive on time, it’s your lucky day. Amazon",2018-05-10,0.95,0.75,0.9166666666666667,0.6666666666666666
34,"Software In Fatal Uber Crash Reportedly Recognized Woman, Then Ignored Her",TECH,The first-of-its-kind accident killed a pedestrian in Arizona earlier this year.,2018-05-07,0.0,0.0,0.25,-0.1
35,Twitter Warns Users To Change All Their Passwords After Finding Bug,TECH,"An “internal defect” led users’ account passwords to be stored in an internal log, the company said.",2018-05-04,0.0,0.0,0.0,0.0
36,Alexa Can Remember Birthdays And Other Things For You Now,TECH,"Last week at a conference in France, Amazon announced a new Alexa feature that makes it possible to use the smart assistant",2018-05-04,0.375,-0.125,0.5410173160173161,0.08766233766233766
37,Apple Watch Credited With Saving New York Man's Life,TECH,The device alerted him to an alarmingly fast heart rate.,2018-05-04,0.45454545454545453,0.13636363636363635,0.6,0.2
38,Facebook Will Let Users See Which Sites Are Tracking Them,TECH,You'll be able to stop Facebook from linking browsing data with your account.,2018-05-01,0.0,0.0,0.625,0.5
39,Facebook Investigates Claim That Employee Used 'Privileged Access' To Stalk Women,TECH,"A Facebook engineer was fired after allegedly self-identifying as a ""professional stalker"" and telling a woman on Tinder that she was ""hard to find.""",2018-05-01,0.0,0.0,0.24722222222222223,-0.09722222222222222
40,Facebook Gets Into The Online Dating Business,TECH,"Facebook (FB) wants to help get you … into a long-term relationship. That’s according to CEO Mark Zuckerberg, who announced",2018-05-01,0.0,0.0,0.1,0.2
41,Facebook Bug Asks Users If Puppies And Bahamas Vacations Are Hate Speech,TECH,A glitch on Tuesday morning led Facebook to question everything posted on the site.,2018-05-01,0.9,-0.8,0.0,0.0
42,WhatsApp Co-Founder To Leave Company Amid Disagreements With Facebook,TECH,Jan Koum reportedly differed with WhatsApp's corporate parent over encryption and user privacy.,2018-04-30,0.0,0.0,0.0,0.0
43,"From Cursing To Murder, Facebook Opens Up About The Site's 'Community Standards'",TECH,"For years, Facebook had “community standards” for what people can post, but only a relatively brief and general version was publicly available.",2018-04-24,0.0,0.0,0.5583333333333333,0.11250000000000002
44,Professor Who Sold Facebook Data To Cambridge Analytica 'Sincerely Sorry',TECH,"Aleksandr Kogan said he assumed people were aware that their data was being taken, but just didn't care.",2018-04-23,1.0,-0.5,0.25,0.25
45,Facebook's Tracking Of Non-Users Sparks Broader Privacy Concerns,TECH,"CEO Mark Zuckerberg said that, for security reasons, the company collects “data of people who have not signed up for Facebook.”",2018-04-15,0.0,0.0,0.0,0.0
46,"Some Criminals Have A ‘Right To Be Forgotten’ On Google, UK High Court Rules",TECH,A London judge says Google must scrub search results related to one man’s prior criminal conviction — but not for another man.,2018-04-13,0.5378571428571428,0.22285714285714286,0.3166666666666667,-0.13333333333333333
47,"Uber Is Adding A Panic Button, 3 Years After Rolling One Out In India",TECH,The app company also says it will run more background checks on its drivers.,2018-04-12,0.0,0.0,0.5,0.5
48,Instagram Rolls Out Focus Feature That Rivals iPhone Portrait Mode,TECH,The new feature works on some Android devices and on Apple phones back to the iPhone 6s.,2018-04-10,0.0,0.0,0.22727272727272727,0.06818181818181818
49,Facebook To Begin Letting Users Know If Their Data Was Harvested By Cambridge Analytica,TECH,The social media giant admitted that up to 87 million users may have been affected.,2018-04-09,0.0,0.0,0.5333333333333333,0.016666666666666666
50,"Sears, Delta Air Lines Say Customers' Payment Info May Have Been Exposed",TECH,"The incident happened on or after Sept. 26, 2017 and was found and resolved on Oct. 12.",2018-04-05,0.0,0.0,0.0,0.0
51,Facebook Is Adding Privacy Wording To Its Policies And Wants Your Feedback,TECH,The company acknowledged last month that a privacy mishap had affected 50 million users.,2018-04-04,0.1,0.2,0.06666666666666667,0.0
52,"Explosive Facebook Memo Defended Company's Strategy, Even If It Got People Killed",TECH,"“We connect people. Period. That’s why all the work we do in growth is justified,"" an executive wrote in 2016.",2018-03-30,0.0,-0.2,0.9,0.4
53,Facebook Employees Are Outraged About -- Wait For It -- Their Own Online Privacy,TECH,The company's reaction to a leaked internal memo shows a shocking lack of self-awareness.,2018-03-30,1.0,-0.15000000000000002,0.5,-0.5
54,"Facebook Still Allows Discriminatory Housing Ads, Despite Pledge To Crack Down: Lawsuit",TECH,"Landlords using the platform's ad technology can exclude women and families with children from viewing rental ads, according to the complaint.",2018-03-28,0.2888888888888889,-0.15555555555555559,0.2,-0.3
55,"Elon Musk Pulls Tesla, SpaceX Facebook Pages In Nod To #DeleteFacebook",TECH,He also deleted his personal profile.,2018-03-23,0.0,0.0,0.3,0.0
56,WhatsApp Co-Founder Says People Should Delete Facebook,TECH,Facebook bought WhatsApp for $19 billion in 2014.,2018-03-21,0.0,0.0,0.0,0.0
57,Can You Really Protect Your Privacy On Facebook?,TECH,Why it might be time for some digital spring cleaning.,2018-03-21,0.2,0.2,0.0,0.0
58,Equifax Says Another 2.4 Million Customers Hit By Data Breach In 2017,TECH,The company's shares were down 2 percent on Thursday.,2018-03-01,0.0,0.0,0.2888888888888889,-0.15555555555555559
59,Wondering What Vero Is? Here's A Primer.,TECH,"The ad-free, privacy-oriented Instagram competitor exploded in popularity this week.",2018-02-27,0.0,0.0,0.0,0.0
60,Re-Introducing The Flipside,TECH,One story. Many perspectives.,2018-02-26,0.0,0.0,0.5,0.5
61,Snapchat's Value Drops $1.3 Billion After 1 Kylie Jenner Tweet,TECH,But she's not the only one getting snippy at Snapchat.,2018-02-23,0.0,0.0,1.0,0.0
62,Instagram May Start Ratting On You If You Screenshot Someone's Story,TECH,"This is Insta-tattling, plain and simple.",2018-02-12,0.0,0.0,0.35714285714285715,-0.10714285714285714
63,Winter Olympics Organizers Probe Possible Cyberattack On Opening Ceremony Day,TECH,All competitions are running as planned as officials continue to investigate a disruption of non-critical systems.,2018-02-10,1.0,0.0,0.0,0.0
64,Google Kicks Off Winter Olympics With Vibrant 'Snow Games' Doodle,TECH,Who knew dogs could ski-jump?,2018-02-09,0.3333333333333333,0.16666666666666666,0.0,0.0
65,Facebook Reportedly Beta-Testing 'Downvote' Button,TECH,Selected users now have the option to flag posts to Facebook.,2018-02-09,0.0,0.0,0.0,0.0
66,"Elon Musk Says He's Sold 10,000 Flamethrowers Through His Boring Co. Website",TECH,“World’s safest flamethrower!”,2018-01-30,1.0,-1.0,0.0,0.0
67,Facebook Pledges To Add More Local News To Newsfeeds,TECH,"""People who know what’s happening around them are more likely to get involved and help make a difference,"" said CEO Mark Zuckerberg.",2018-01-30,0.25,0.25,0.75,0.25
68,ATM Makers Issue Warning About Cyber Criminals Targeting Cash Machines,TECH,"A confidential U.S. Secret Service alert sent to banks said the hackers targeted stand-alone ATMs typically located in pharmacies, big box retailers and drive-thru ATMs.",2018-01-29,0.0,0.0,0.43333333333333335,-0.18888888888888888
69,'Trap Adventure 2' Might Be The Most Infuriatingly Difficult Game Ever,TECH,"If you like chucking your phone across the room, this is the game for you.",2018-01-25,0.6333333333333333,-0.13333333333333333,0.4,-0.4
70,Montana Becomes First State To Set Its Own Net Neutrality Rules,TECH,"""We can't wait for folks in Washington to come to their senses,"" says Montana Gov. Steve Bullock.",2018-01-23,0.4444444444444444,0.2833333333333333,0.0,0.0
71,Watch As A Drone Saves Two Teen Swimmers From Heavy Surf In Australia,TECH,"""Never before has a drone fitted with a flotation device been used to rescue swimmers like this.""",2018-01-18,0.25,-0.1,0.0,0.0
72,YouTube's 'Open Letter' About Logan Paul Isn't Very Open At All,TECH,YouTube didn't address what penalties Paul might face for his controversial video showing a dead body.,2018-01-10,0.575,0.0,0.675,0.17500000000000002
73,Former Google Engineer Suing Company Over Perceived Discrimination Against White Men,TECH,The writer of a controversial Google memo is accusing the company of silencing conservative viewpoints.,2018-01-09,0.0,0.0,0.95,0.55
74,Investors Urge Apple To Tackle ‘Growing’ Evidence Of Device Addiction In Kids,TECH,"""There is no good reason why you should not address this issue proactively,"" the shareholders wrote.",2018-01-08,0.0,0.0,0.6000000000000001,-0.35
75,Apple Eyes Fix For Chip Flaw Leaving Consumers Without Secure Web Browsing,TECH,"With Safari and virtually all other popular browsers not patched, hundreds of millions of iPhone and iPad users may not have secure means of web browsing until Apple issues its patch.",2018-01-05,0.6,0.4,0.625,0.2916666666666667
76,Silicon Valley's Problematic Sex Parties On Blast In Upcoming Book,TECH,"""You’re damned if you do, damned if you don’t,"" one woman said of attending these secret gatherings.",2018-01-03,0.0,0.0,0.7,-0.4
77,2017 Was The Year Of Hacks. 2018 Probably Won't Be Better.,TECH,"Remembering Equifax, Uber and all the other data breaches of the last year.",2017-12-30,0.5,0.5,0.22083333333333333,-0.0625
78,Spend Winter Curled Up With Your Favorite On-Sale Movies And Shows,TECH,The sale starts Dec. 29.,2017-12-28,1.0,0.5,0.0,0.0
79,The Bitcoin Hoax,TECH,We should hardly be surprised that Bitcoin is on a wild speculative ride—that’s the essence of privatized credit creation.,2017-12-24,0.0,0.0,0.65,0.1
80,Apple Confirms It Slows Down Old iPhones As Their Batteries Age,TECH,But only in certain circumstances.,2017-12-21,0.24444444444444446,-0.02777777777777779,0.7857142857142857,0.10714285714285714
81,Facebook Is The Enemy Now,TECH,The tech giant has proven time and again that it doesn’t deserve our trust.,2017-12-20,0.0,0.0,1.0,0.0
82,Genius Hack Shows How To Use Amazon Prime Now To Help The Homeless,TECH,A heartwarming video perfectly captures the spirit of the season.,2017-12-19,0.0,0.0,1.0,1.0
83,"Being A Facebook Wallflower Isn't Good For You, The Social Site Says",TECH,"That's why everyone has to start posting, the company argues in a blog post.",2017-12-16,0.33333333333333337,0.36666666666666664,0.0,0.0
84,What The End Of Net Neutrality Means For Native Communities,TECH,The divide just got a LOT bigger.,2017-12-15,0.0,0.0,0.5,0.0
85,Woman In China Says Colleague’s Face Was Able To Unlock Her iPhone X,TECH,"It could also be cheeky passcode training, an Apple spokesman says.",2017-12-15,0.625,0.5,0.0,0.0
86,Apple To Buy Shazam Amid Rumors It Will Phase Out iTunes Downloads,TECH,Apple says the rumors aren't true.,2017-12-11,0.0,0.0,0.65,0.35
87,Privacy Battle Brewing: Are LinkNYC Kiosks Surveillance Devices?,TECH,In 2016 LinkNYC began deploying free public Wi-Fi kiosks throughout the city. The kiosks made news when people began using,2017-12-06,0.0,0.0,0.43333333333333335,0.2
88,Amazon Has 12 Amazing Days Of Deals That You Don't Want To Miss,TECH,"If you’re still looking for gift inspiration, these 12 days have got you covered",2017-12-04,0.9,0.6000000000000001,0.0,0.0
89,Meet The Man Who Temporarily Deleted Trump's Twitter Account,TECH,The former employee who had shut down The Donald for 11 minutes says he loves Twitter and America.,2017-11-30,0.0,0.0,0.14444444444444446,-0.07777777777777779
90,Facebook Says It's Getting Pretty Good At Filtering Out Terrorists,TECH,And it's working with other companies to scrub the internet of recruitment propaganda.,2017-11-29,0.8,0.475,0.2375,-0.1125
91,10 Of The Best Cyber Monday TV Deals You'll Actually Want To Shop,TECH,📺📺📺,2017-11-27,0.2,0.5,0.0,0.0
92,Elon Musk's Tweet Gives Creepy Insight Into Future Of Humanoid Robots,TECH,"""In a few years, that bot will move so fast you’ll need a strobe light to see it. Sweet dreams…""",2017-11-26,0.5625,-0.25,0.5125,0.1875
93,"Justin Trudeau, Other World Leaders Praise Net Neutrality Ahead Of FCC's Planned Repeal",TECH,"Scrapping current regulations “does not make sense,"" the Canadian prime minister said Wednesday.",2017-11-23,0.1875,-0.0625,0.4,0.0
94,Amazon Launches 'Secret' Cloud Service For Intelligence Agencies,TECH,Amazon Web Services Secret Region expands after some troubling cloud security screwups.,2017-11-21,0.7,-0.4,0.7,-0.4
95,Apple Black Friday Deals That Are Actually Worth Your Time And Money,TECH,The wait is over.,2017-11-20,0.26666666666666666,0.06666666666666667,0.0,0.0
96,Here's How To Get Free 2-Day Shipping On Your Black Friday Purchases,TECH,"Move over, Amazon 👋",2017-11-16,0.6166666666666667,0.11666666666666668,0.0,0.0
97,Here's Where To Get The Best Black Friday Deal On An XBox One,TECH,"For hobbyist gamers, the Xbox One S is a wallet-friendly choice 🎮",2017-11-16,0.3666666666666667,0.4166666666666667,0.0,0.0
98,Amazon Just Released A Sneak Peek At Its Black Friday Deals,TECH,🔍👀,2017-11-15,0.43333333333333335,-0.16666666666666666,0.0,0.0
99,15 Black Friday Laptop Deals Actually Worth Your Time And Money,TECH,There’s something on sale for every type of user 💻,2017-11-15,0.26666666666666666,0.06666666666666667,0.0,0.0
100,Lack Of Diversity In Tech Makes It Difficult To Override Russian Fake News,TECH,"The outrage over Russian manipulation of social media platforms like Facebook, Google and Twitter during the 2016 election",2017-11-14,0.6666666666666666,-0.3333333333333333,0.03333333333333333,0.016666666666666666
101,Company Blames Secret Intimate Recordings By Sex Toy On 'Minor Bug',TECH,Vibrator app wasn't directed to eavesdrop.,2017-11-13,0.49999999999999994,-0.08333333333333333,0.0,0.0
102,"Twitter 'Verifies' Jason Kessler, Organizer Of Charlottesville White Supremacist Rally",TECH,"In response to the backlash, Twitter paused its verification process, saying it needs to reconsider a broken system.",2017-11-09,0.0,0.0,0.4,-0.4
103,The Fakebook Inside Facebook,TECH,"This post first appeared at BillMoyers.com. Beginning in 2004, Mark Zuckerberg and his companions made a historic contribution",2017-11-07,0.0,0.0,0.16666666666666666,0.125
104,"As Puerto Rico Struggles In Darkness, Tesla Brings Light To Children’s Hospital In San Juan",TECH,The company is making quick work of its promise to help restore power to the hurricane-ravaged island.,2017-10-26,0.7,0.4,0.5,0.3333333333333333
105,Amazon To Sell Smart Locks So It Can Slip Packages Into Your Home,TECH,The move signals Amazon’s ambitions in the growing market for home security devices.,2017-10-25,0.6428571428571429,0.21428571428571427,0.0,0.0
106,Silicon Valley Veteran Says Tech Giants 'More Powerful Than AT&T Ever Was',TECH,"“We have more and more concentrated power and wealth,"" Sam Altman said.",2017-10-19,0.5,0.26666666666666666,0.5,0.5
107,How A New Technology Could Help Find The Next Harvey Weinstein,TECH,"Callisto has already empowered survivors on college campuses, but people want to see it expand to Hollywood and tech.",2017-10-16,0.22727272727272727,0.06818181818181818,0.0,0.0
108,What To Do If You Think An Online Account Has Been Hacked,TECH,"Fortunately, you can take action in the face of digital vandalism.",2017-10-13,0.0,0.0,0.26666666666666666,0.16666666666666666
109,Sheryl Sandberg: Russian Targeting On Facebook 'Should Not Have Happened',TECH,"Facebook owes America an apology, she said.",2017-10-12,0.0,0.0,0.0,0.0
110,"Adults Must Teach Kids To Use,  Not Be Used By, Social Media",TECH,"I was an archetypical progressive educator, respecting the autonomy of students and empowering them to follow their passions",2017-10-11,0.06666666666666667,0.03333333333333333,0.0,0.0
111,AOL Instant Messenger To Sign Off Forever After 20 Years,TECH,"TTY never, AIM :'(",2017-10-06,0.6666666666666666,0.0,1.0,-1.0
112,We Should Make AI And Blockchain Boost Global Trade,TECH,It is time to build an intelligent tech and trade initiative.,2017-09-30,0.0,0.0,0.9,0.8
113,The 7 Problems With Our Phones,TECH,"We are addicted to our phones not because we rely on them, but to the extent that we recruit them to a harmful project of self-avoidance.",2017-09-21,0.0,0.0,0.6,-0.4
114,Does The World Need A ‘Marshall Plan’ For Technology?,TECH,Investing in global infrastructure should include fast and secure digital connectivity The idea of economic planning dominated,2017-09-17,0.0,0.0,0.27999999999999997,0.16
115,Facebook Tightens Rules On Who Can Cash In On Ads,TECH,The social network is responding to criticism that it is too simple for providers of fake news and sensational headlines to cash in.,2017-09-13,0.0,0.0,0.5226190476190476,0.04999999999999999
116,Apple Launches iPhone X With Edge-To-Edge Display,TECH,"The phone features wireless charging, an infrared camera and special hardware for facial recognition.",2017-09-12,0.0,0.0,0.2857142857142857,0.17857142857142858
117,Women In Tech: An Interview With Wendy Lea,TECH,"I was able to sit down with Wendy Lea, CEO of Cintrifuse, and talk about her career, and the question how tech can be more",2017-09-11,0.0,0.0,0.4712962962962963,0.2814814814814815
118,"If You Are Worried About 'Hacked' Democracy, Quit Facebook",TECH,"You’ll help weaken its business model, which is the most impact you can have.",2017-09-11,0.0,0.0,0.5,0.5
119,Using Twitter To Save A Newborn From A Flood,TECH,Social media provided stranded people with a digital megaphone that could be carried far beyond Harvey’s path.,2017-08-30,0.0,0.0,0.35555555555555557,0.044444444444444446
120,Uber Reportedly Picks Dara Khosrowshahi As New CEO,TECH,Dara Khosrowshahi faces a daunting task.,2017-08-28,0.45454545454545453,0.13636363636363635,0.0,0.0
121,Google Cancels 'Town Hall' On Gender Dispute Over Fears Of Online Harassment By Far-Right,TECH,The company-wide meeting was slated to discuss the controversy over a memo opposing diversity policies.,2017-08-11,0.0,0.0,0.0,0.0
122,Fired Google Engineer Blames Diversity Zealots For His Dismissal,TECH,"James Damore's Wall Street Journal essay decries ""public shaming.""",2017-08-11,0.0,0.0,0.06666666666666667,0.0
123,Former Google Engineer James Damore Takes Refuge Among The Alt-Right,TECH,"For a man who’s claimed he values “diversity and inclusion,” these are some very odd bedfellows.",2017-08-10,0.0,0.0,0.325,-0.21666666666666667
