,headline,category,short_description,date,Subjectivity,Polarity,Content Subjectivity,Content Polarity
1244,See 54 Years Of Internet History In One Cool Timeline,TECH,"Connecting billions of devices, machines, sensors and appliances to the Internet could generate tremendous economic value",2015-07-13,0.65,0.35,0.6,0.26666666666666666
1245,"To Protect Your Privacy, Avoid Sharing These Things Online",TECH,It doesn't take a cyber-security expect to know that you shouldn't share your email password or Social Security number on,2015-07-10,0.0,0.0,0.06666666666666667,0.03333333333333333
1246,"In The Debate Over Strong Encryption, Security And Liberty Must Win",TECH,"Protecting the privacy of citizens from those who would do them harm or steal from them is now intrinsically bound to encrypting devices, communications and data.

That's true whether for cellphones, email, health records, tax transcripts or the personnel files of  tens of millions of public servants.",2015-07-10,0.5666666666666667,0.6166666666666667,0.35833333333333334,0.175
1247,How Black Twitter Helped Take Down The Confederate Flag,TECH,The story behind a hashtag that helped transform the nation's opinion at hyper-speed.,2015-07-10,0.36111111111111116,-0.16111111111111112,0.7,-0.4
1248,Facebook's Small New Update Is Actually Pretty Huge,TECH,"On Thursday, Facebook announced a change to its News Feed: Instead of passively following the glut of content selected by",2015-07-09,0.6886363636363636,0.1340909090909091,0.1,0.0
1249,Federal Election Commission Shows How To Disclose Data In A Digital Democracy,TECH,"On Tuesday, the Department of Homeland Security showed how to deploy government technology poorly. Now, the Federal Election",2015-07-08,0.0,0.0,0.6,-0.4
1250,NYC’s Chief 'Nerd In City Hall' Wants Internet Access And Equality For All,TECH,"Based upon your experiences to date, what advice would you give to other people in the tech industry considering public service",2015-07-08,0.1,0.2,0.22083333333333333,-0.0625
1251,"New Federal Government App Solves The Wrong FOIA Problems, Poorly",TECH,I've asked DHS all of these questions. If I receive a response to them or to the FOIA request that may or may not have been,2015-07-07,0.6515151515151515,-0.2545454545454546,0.0,0.0
1252,13 Tips For Parenting When Screens Are Everywhere,TECH,"When I started writing a column about parenting and screen time this spring, I talked to a lot of people about technology",2015-07-06,0.0,0.0,0.0,0.0
1253,This Is Why You Should Never Send A Terrorist Threat To An Airline On Twitter,TECH,A Twitter user is learning the hard way that threatening a major airline on social media is not the best idea. In a statement,2014-04-13,0.0,0.0,0.3520833333333333,0.20104166666666667
1254,Heartbleed: Free Tool to Check if That Site Is Safe,TECH,I'm sure you've heard the news about Heartbleed by now (unless you're in vacation wonderland and have taken a tech break). This is a serious vulnerability in the core of the Internet and is something we all should be concerned about.,2014-04-12,0.65,0.45,0.7777777777777777,0.08333333333333334
1255,6 Ways College Grads Can Protect Their Online Reputations,TECH,The prospective employer these days may be more interested in what your name pulls up in search engines than how perfectly coordinated your shoes are with your power suit.,2014-04-12,0.0,0.0,0.6666666666666666,0.5833333333333334
1256,Instagram Down: Users Unable To Share Saturday Brunch Photos [UPDATE],TECH,"We’re working to fix a feed delivery issue. Thank you for your patience. — Instagram (@instagram) April 12, 2014 A representative",2014-04-12,0.3944444444444445,-0.3277777777777778,0.0,0.0
1257,Digital Marketing In The Era Of The Empowered Consumer,TECH,"Even though Brinker's passion is marketing tools he says at the end of the day they are but a means to an end. The real focus is how marketing is changing to deliver a better customer experience with digital technologies, which comes down to the people and process.",2014-04-06,0.0,0.0,0.27222222222222225,0.1361111111111111
1258,Yahoo Looking To Enter Original Programming Game: WSJ,TECH,"Web giant Yahoo is not known for online video, but it's looking to change that. The company is close to ordering four different",2014-04-06,0.575,-0.012500000000000011,0.8,0.0
1259,"Google Really, Really Wants To Trademark The Word 'Glass'",TECH,"According to The Wall Street Journal, the company submitted an application last year for a trademark on the word, but was",2014-04-05,0.1,0.2,0.06666666666666667,0.0
1260,Mozilla CEO's Resignation Sparks Debate In Silicon Valley,TECH,"AN APOLOGY Some cheered his resignation, including OkCupid. Before his resignation, Eich posted an apology on his blog for",2014-04-05,0.0,0.0,0.0,0.0
1261,The Evolution of Online Safety: Lessons Learned Over 20 Years,TECH,Over time it became increasingly obvious that some of the biggest risks to kids came not from dangerous adults but from themselves and other kids.,2014-04-05,0.0,0.0,0.5916666666666667,-0.24166666666666667
1262,How Mark Zuckerberg's Control Of Facebook Lets Him Print Money,TECH,When Mark Zuckerberg pays astronomical prices for unprofitable start-ups like Oculus ($2 billion) and WhatsApp ($19 billion,2014-03-30,0.0,0.0,0.0,0.0
1263,Be Your Family's Chief Security Officer,TECH,"I won't lie: This kind of vigilance requires a lot of thought to get it rolling. It's not second nature to many people, but they can work on that element and improve over time so that it's automatic to put the alarm system on when going to bed.",2014-03-23,0.0,0.0,0.4666666666666666,0.3666666666666667
1264,Privacy Is More Than Locking Your Doors,TECH,There are 10 distinct meanings of privacy.,2014-03-22,0.5,0.5,0.3,0.3
1265,"Revealed: Apple And Google's Wage-Fixing Cartel Involved Dozens More Companies, Over One Million Employees",TECH,"Back in January, I wrote about “The Techtopus” — an illegal agreement between seven tech giants, including Apple, Google",2014-03-22,0.5,0.5,0.25,-0.25
1266,Drugstore Delivery Drones Are Coming To San Francisco,TECH,"“Well, we know that gentrification is a hot topic in the Mission and we want to be sensitive to that,” a QuiQui representative",2014-03-22,0.0,0.0,0.875,0.175
1267,Bill Gates Sounds Skeptical Of Zuckerberg's WhatsApp Deal: 'I Hope It Works Out For Him',TECH,"Besides the high price, the Facebook-WhatsApp deal has also been controversial because of the companies' opposing takes on",2014-03-16,0.5,-0.5,0.7449999999999999,0.35500000000000004
1268,The Guardian's Chief Digital Officer on Going 'Digital-First',TECH,"4. Embrace the ethos of continual development - The Guardian has adopted a very iterative, agile approach for their product",2014-03-16,0.0,0.0,0.525,0.35
1269,A New U.S. Global Policy in Communications,TECH,The developing countries were expressing their frustration with what they were calling a form of electronic colonialism with,2014-03-15,0.22727272727272727,0.06818181818181818,0.0,0.0
1270,This Is The Worst Coupon Of All Time,TECH,"Thanks? The CFA Institute's David Schawel noticed this Google Offer for ""free napkins when you buy coffee."" But that's not",2014-03-09,1.0,-1.0,0.5,0.30000000000000004
1271,Twitter Pays $36 Million To Avoid IBM Patent Suit,TECH,"Twitter wants to reform the patent system. But for the moment, it’s still paying big bucks to avoid the kind of software",2014-03-08,0.0,0.0,0.3666666666666667,0.26666666666666666
1272,Russia Goes for Gold in Internet Regulation,TECH,The NSA revelations have badly hobbled the United States' ability to be a force for moral leadership in this debate. The,2014-03-02,0.0,0.0,0.4583333333333333,-0.3499999999999999
1273,Making Sense of All That Data,TECH,"The course is self-paced which means you can log on anytime day or night.  You will be learning the basics of data organization, the steps of the data process, how to create and use Google Fusion Tables, how to organize and create charts.",2014-03-02,0.0,0.0,0.0,0.0
1274,Inside The Monumental Offices Of Tech Giants,TECH,"Big Internet companies love to talk about how they are “disrupting” one thing or another, but they still want what big companies",2014-03-02,0.0,0.0,0.26666666666666666,0.16666666666666666
1275,DIY Home Security Automation is easy,TECH,Surveillance cameras. The latest technology allows you to remotely view your premises. Your phone will receive an alert from,2014-03-01,0.8333333333333334,0.43333333333333335,0.55,0.2
1276,Space Debris Demands a Global Approach,TECH,"While there is still more ground to cover, if we work together as a global industry, these immediate steps can help ensure a dramatic movie plot does not become our stark reality.",2014-03-01,0.0,0.0,0.42500000000000004,-0.033333333333333326
1277,"Google Will Soon Know You Better Than Your Spouse Does, Top Exec Says",TECH,"As creepy as this may sound to some, Kurzweil -- who has long contended that computers will outsmart us by 2029 -- believes",2014-02-23,0.5,0.5,0.6,-0.04999999999999999
1278,Netflix Makes A Deal With Comcast To End Traffic Jam,TECH,"Read more on Reuters The announcement comes as Comcast prepares to acquire Time Warner Cable for $45 billion, a deal that",2014-02-23,0.0,0.0,0.5,0.5
1279,FCC Can Free the Cities,TECH,"Most cities, therefore, already subsidized in some small way by a cable franchise or largesse of the local telephone monopoly -- are afraid to act or simply unaware of the stakes. This new thinking on the part of the FCC could free the cities.",2014-02-23,0.8,0.4,0.5077922077922078,0.02662337662337663
1280,Comcast And Netflix Make A Deal To End Traffic Jam,TECH,"At the same time, Federal regulators are wrestling with an issue known as ""Net neutrality"" concerning broadband providers",2014-02-23,0.0,0.0,0.0625,0.0
1281,These 20 Pokemon Will Make You Think Twice Before Trying To Catch 'Em All,TECH,"Without further ado, here are the 20 weirdest, most random Pokemon that have been created since the beginning of the series",2014-02-22,0.0,0.0,0.5,0.0
1282,Apple Security Flaw Could Allow Hackers To Intercept Emails,TECH,"Apple released software patches and an update for the current version of iOS for iPhone 4 and later, 5th-generation iPod",2014-02-22,0.0,0.0,0.2,0.0
1283,The Disappointing Contradictions of WhatsApp Being Acquired By Facebook,TECH,"The founders of WhatsApp, a smartphone messaging service that is wildly popular around the world, proudly declared they would never make their users the product. They built their brand off of this guiding philosophy and used it to differentiate themselves in a crowded market.",2014-02-22,0.7,-0.6,0.95,0.7
1284,'Neknominate' Is a Stupid and Potentially Deadly Online Dare Game,TECH,"New twist on a very old theme The Mirror, a British tabloid reported about a 29 year-old who died as a result of quickly",2014-02-22,0.6,-0.4666666666666666,0.30363636363636365,0.1499242424242424
1285,"UH-OH: WhatsApp, Facebook's New $19 Billion App, Is Down (Update: It's Back)",TECH,This is probably not the best way to start off life under Facebook. We reached out to WhatsApp for more details and will,2014-02-22,0.24781144781144782,-0.006397306397306411,0.4,0.75
1286,On the Timing of iOS's SSL Vulnerability and Apple's ‘Addition' to the NSA's PRISM Program,TECH,"Sure would be interesting to know who added that spurious line of code to the file. Conspiratorially, one could suppose the",2014-02-22,0.0,0.0,0.6944444444444444,0.5
1287,Meet The Man Who Uncovered The Target Hack,TECH,"SAN FRANCISCO — In the last year, Eastern European cybercriminals have stolen Brian Krebs’s identity a half dozen times, brought",2014-02-17,0.0,0.0,0.07777777777777778,-0.05555555555555555
1288,Tightening up Security Is Everyone's Responsibility,TECH,IT professionals are only as good as their weakest link: the rest of the employees who refuse to play a role in company security will bring down the ship.,2014-02-17,0.0,0.0,0.6296296296296297,0.18148148148148147
1289,Do CIOs Need Passion To Succeed? Analysts Debate,TECH,Here are 5 hot themes for 2014 that CIOs will want to keep in mind as they head into the age of digital.,2014-02-17,0.0,0.0,0.42500000000000004,0.125
1290,Tea Leaves on Comcast's Bid for Time Warner,TECH,The first truly national cable television provider will be born and the tea leaves prophesy that it will grow to be bigger and way worse for consumers and competition than the Sprint-T-mobile merger could ever have been.,2014-02-17,0.0,0.0,0.4777777777777777,-0.05000000000000001
1291,Tesla CEO Elon Musk Met With Apple Executives: Report,TECH,"“While a megadeal has yet to emerge (for all of its cash, Apple still plays hardball on valuation), such a high-level meeting",2014-02-17,0.0,0.0,0.5,0.0
1292,"No, Facebook Didn't Crush Upworthy's Traffic",TECH,Media analysts have been buzzing this last week about how this chart proves that a December change to the Facebook newsfeed algorithm is bringing the Upworthy media empire crashing down.,2014-02-16,0.0,0.0,0.11851851851851852,0.048148148148148134
1293,The Most Epic Game Of 'Pokemon' Is Happening Right Now,TECH,"Gif via Wario64 The image above shows the game unfolding on the left. On the right is the chat box, where you can see the",2014-02-16,0.45892857142857146,0.12142857142857141,0.2589285714285714,-0.02857142857142858
1294,"Kickstarter Hacked, Site Says Some Data Stolen",TECH,"Hackers breached the crowdfunding website Kickstarter and made off with some user information, the site revealed on Saturday",2014-02-15,0.0,0.0,0.0,0.0
1295,12 Reasons Google+ Isn't As Bad As You Think,TECH,"If you want to watch people using Google Glass, circle Glass Explorers Brett Lipton, Daniel Fontaine, Bobbie Today, Derek",2014-02-15,0.6666666666666666,-0.6999999999999998,0.0,0.0
1296,How Mentoring May Be the Key to Solving Tech's Women Problem,TECH,"Without women to look to at the top, many women in STEM fields get discouraged and leave the workforce. However, one group is changing that.",2014-02-09,1.0,0.0,0.5,0.5
1297,Google Glass' Potential,TECH,"I see Google Glass as a critical platform in achieving this bright future of memory preservation. With the development of Glass, Evergram, and many more apps, neither discussed nor created yet, I see the possibility created for the easy collection and transmission of memories and thoughts.",2014-02-09,1.0,0.0,0.5930555555555556,0.3555555555555556
1298,There Has Never Been a Better Time for CIOs to Fix IT's Reputation,TECH,"A recent Gartner study predicts that by 2015, 25 percent of large global organizations will appoint a Chief Digital Officer (CDO). The CIO and Enterprise IT, Mike Kail, CIO of Netflix offers a refreshing perspective.",2014-02-09,0.5,0.5,0.27976190476190477,0.1357142857142857
1299,Kansas City Man Predicts ESurance Super Bowl Commercial Winner Before Announcement,TECH,So how in the world is it possible that JohnnyOptimist was able to predict this? Did he have or get inside info? Is he truly a psychic? The answer is none of the above.,2014-02-08,0.3333333333333333,0.16666666666666666,0.5750000000000001,0.16666666666666666
1300,'Flappy Bird' Creator Taking App Down: 'I Cannot Take This',TECH,"While ""Flappy Bird"" was reportedly bringing in some $50,000 in sales daily, according to The Verge, Nguyen added that he",2014-02-08,0.2888888888888889,-0.15555555555555559,0.0,0.0
1301,Innovation In Financial Services-Oxymoron?  Future Tech Lessons Learned From The Asian Financial Forum,TECH,"Today, there is extra urgency behind the need for a shift toward innovation: many new financial services competitors that are small, nimble and on the cutting edge of technology entered the market right after the financial crisis, when established firms were busy licking their wounds. The old guard is going to need to stay on top of innovation just to keep up with the new guard.",2014-02-08,0.03125,0.0,0.38806193806193795,0.03911088911088911
1302,The Sochi Olympics' Official Website Is Bizarre And Extremely Russian,TECH,Enough baby pacifiers for 125 hockey teams?! What an accomplishment! We all know you're buying that creepy bear mascot just,2014-02-08,0.3,0.2,0.75,-0.25
1303,Which Game Should Have Won 'Game Of The Year'? (POLLS),TECH,Click here for the winner! Winner: Grand Theft Auto V Click here for the winner! Winner: The Last of Us Click here for the,2014-02-08,0.4,-0.4,0.5333333333333333,0.3125
1304,President Obama Confident FCC Will Use Authority to Save Net Neutrality,TECH,President Barack Obama on Friday affirmed his strong support for Net Neutrality and expressed confidence that the Federal Communications Commission will use its authority to protect the open Internet.,2014-02-01,0.4166666666666667,0.25,0.41111111111111115,0.14444444444444443
1305,Why You Should Care about Social Network Over-Sharing,TECH,"Everybody has a ""friend"" on social media that clogs up the newsfeed with excessive posts and pics that are more nuisance than news. This ""friend"" may share too many items, too often. Let's face it, in some cases, that ""friend"" could be you.",2014-02-01,0.06666666666666667,0.03333333333333333,0.5166666666666666,0.19583333333333333
1306,A Bright Spot in the Dark Side of Technology,TECH,"Next, companies need to flip it around and focus on the next 6-12 months (not the typical next 1-5 years) and ask, ""What",2014-01-26,0.6,0.275,0.125,-0.041666666666666664
1307,Google Isn't Going To Sue Samsung Like Apple,TECH,"The deal covers patents currently owned by the companies, as well as any filed in the next 10 years, the companies said in",2014-01-26,0.0,0.0,0.2,0.0
1308,"29 Best Vines Of The Week In 1 Video: Jan. 17 - Jan. 24, 2013 (VIDEO)",TECH,"Vine, Twitter’s micro-video social network, recently celebrated its 1st anniversary. With a limit of six seconds per video",2014-01-26,0.3,1.0,0.4083333333333333,0.19166666666666665
1309,Amazon and Local. Almost Friends.,TECH,Anyone who ever tried to return something to the now thankfully defunct Circuit City remembers the walk of shame and accusatory interrogation whenever anything needed to be returned or exchanged. Amazon simply smiles and give you your money back -- a breeze.,2014-01-26,0.0,0.0,0.17857142857142858,0.0
1310,Behind the Scenes at Tech Companies: Employees Teach Each Other How to Code,TECH,"Successful, thriving company culture becomes evident in its employees. Specifically, employees will be empowered to find ways to give back and empower others -- and there's no better place to start than with your co-workers.",2014-01-25,0.5375,-0.2625,0.425,0.1875
1311,Lost 30-Year-Old Conversation With Steve Jobs Offers Answers,TECH,"On a late-November day in 1983, Steven Levy, then a freelance journalist for Rolling Stone, got into a car outside 10460",2014-01-25,0.0,0.1,0.05,0.0
1312,Enterprise Software: Simplicity Drives Customer Benefit,TECH,Mobile first user experience: Mobile is super-important to the enterprise application industry. Workday is increasingly widening,2014-01-25,0.0,0.0,0.3333333333333333,0.25
1313,WATCH: Amazon Thinks It Can Predict Your Next Order,TECH,"You shouldn't expect all your wish list items to magically appear tomorrow, but Amazon does have an idea that may help it get ahead in the same-day delivery war.",2014-01-25,0.0,0.0,1.0,0.5
1314,Google Glass May Be The Future Of The Porn Industry,TECH,One of the best attended discussions of the day was a demonstration of how adult films could be viewed as well as produced,2014-01-25,0.125,0.0,0.3,0.55
1315,"Medical Tech, 'iPhone 6' And More In This Week's Apple Rumors",TECH,"In July, a 9to5 Mac report said that in the coming years, Apple may work to integrate Touch ID fingerprint technology into",2014-01-20,0.25,0.25,0.0,0.0
1316,App Neutrality Should Be Part of the Net Neutrality Discussion,TECH,I bet you think the mobile Internet is open. That if you write the next great mobile app there is nothing that can stop it from fulfilling its destiny. That if you create a mobile content app that blows away Netflix there is nothing that can stop it. Wrong.,2014-01-20,0.0,0.0,0.5375,0.07500000000000001
1317,These People Think Today Is 'Martian Luther King Jr. Day',TECH,"Clearly they didn't learn from this New York high school that said no school on its main billboard in honor of ""Dr. Martian",2014-01-20,0.0,0.0,0.4278030303030303,0.14075757575757575
1318,"From Gandhi To MLK, History's Giants Have Become Marketing Tools",TECH,When Google honored African American author Zora Neale Hurston with a custom logo — a Google Doodle — on its homepage earlier,2014-01-19,0.0,0.0,0.16666666666666666,0.0
1319,Why Silicon Valley Should Write Chile a Much Deserved Thank You Note,TECH,"Specifically with respect to innovation, Chile has abandoned its old spot in the innovation wasteland and is now known as a growing global hub for entrepreneurship.",2014-01-19,0.2,0.2,0.1,0.05
1320,Amazon Just Patented Shipping Items Before They're Even Ordered,TECH,"Of course, Amazon wouldn't ship items ahead of time in the absence of clear demand for the product. To assess that demand",2014-01-18,0.0,0.0,0.19166666666666665,0.04375000000000001
1321,Target Under Fire For Not Revealing Hacks Earlier,TECH,A Neiman Marcus spokeswoman has said the delay in going public was because the company was investigating the extent of the,2014-01-18,0.5,0.0,0.06666666666666667,0.0
1322,Life On A Social Media Island--Where Digital Natives And Digital Immigrants Must Collaborate,TECH,We can remember our first Compaq portable computers in the 1980s but that doesn't mean we are less savvy with Twitter or Facebook than younger generations.,2014-01-18,0.022222222222222223,0.011111111111111112,0.271875,-0.057291666666666664
1323,WATCH: Authenticity (Still) Rules,TECH,More about Shawn's colorful past can be read in his HuffPost serial: Cookies & Milk: Scenes from a '70s Hollywood Childhood,2014-01-11,0.0,0.0,0.3833333333333333,0.18333333333333335
1324,Rap Genius: 'We're Sorry For Being Such Morons',TECH,"To win over Google again, Rap Genius culled together a list of 177,781 webpages linking to the site and systemically asked",2014-01-05,0.8333333333333334,-0.43333333333333335,0.4,0.8
1325,Siri Gets Sassy When You Ask About 'Her',TECH,"""Her,"" a movie about a man falling in love with a piece of voice software, has been in theaters for about three weeks. (The",2014-01-05,0.0,0.0,0.6,0.5
1326,Jeff Bezos Rescued By Ecuadorian Navy,TECH,"Galapagos National Park draws many wealthy and famous visitors among the roughly 180,000 tourists who visit every year to",2014-01-04,0.0,0.0,0.725,0.35
1327,Rumor Has It That 2014 Will Finally Be The Year Of The 'iWatch',TECH,"Apple Glass ... iOS 7.1 Coming in March It's time for another installment of ""This Week In Apple Rumors,"" where we bring",2014-01-04,1.0,0.0,0.0,0.0
1328,4.6 Million Snapchat Accounts Leaked After Startup Brushed Off Security Concern,TECH,"""Theoretically, if someone were able to upload a huge set of phone numbers, like every number in an area code, or every possible",2014-01-01,0.1,0.0,0.65625,0.22500000000000003
1329,Here's To The Nerds: Celebrating A New Definition,TECH,"Perhaps this conjures up an image of a circle of poorly-dressed, skinny dudes staying up late to play Settlers. But that’s",2013-12-29,0.45454545454545453,0.13636363636363635,0.6,-0.3
1330,Documents Reveal The NSA's Top Hacking Unit,TECH,The NSA's TAO hacking unit is considered to be the intelligence agency's top secret weapon. It maintains its own covert network,2013-12-29,0.5,0.5,0.7333333333333334,0.2333333333333333
1331,8 Arrested In Spain Over Global Bank Cyber Heists,TECH,"The swiftness and scale of the heists was revealed earlier this year, when U.S. prosecutors arrested seven men suspected",2013-12-29,0.0,0.0,0.5,0.0
1332,Flying Yacht Is A Taste Of The Future (VIDEO),TECH,"If a large yacht somehow fails to adequately convey fabulous wealth to you, then maybe a large flying yacht will do the trick",2013-12-29,0.125,0.0,0.49809523809523804,0.13238095238095238
1333,Reddit Is Trying Something New: Making A Profit,TECH,"(Editing by Edwin Chan, Martin Howell and Prudence Crowther) Yet those sales alone could put Reddit firmly in the black, said",2013-12-28,0.45454545454545453,0.13636363636363635,0.4166666666666667,-0.18333333333333335
1334,Researchers: Teens 'Embarrassed To Even Be Associated' With Facebook,TECH,"Facebook is 'dead and buried' to older teenagers, an extensive European study has found, as the key age group moves on to",2013-12-28,0.0,0.0,0.4133333333333333,-0.0066666666666666706
1335,New Trends in Wearable Technology,TECH,"Smart Glass is no longer the sole domain of Google. Originally developed by the military to give soldiers ""Terminator vision"" while leaving their hands free to maneuver weapons, multiple manufacturers are releasing their own interpretation of how this wearable tech can improve the quality of your life.",2013-12-25,0.45454545454545453,0.13636363636363635,0.4418367346938776,0.17346938775510207
1336,"Watch This Awesome Holiday Message Delivered Using 2,000 iPhones",TECH,Sometimes we come across a video that requires a great deal of exposition and depth to fully relate its complexity. This,2013-12-25,1.0,1.0,0.75,0.8
1337,An Unlikely Assessment Tool,TECH,"Decked out in my duct tape bracelet and Camp Invention t-shirt, I blend into the invention playfield and disappear on the sidelines of the Camp Invention program room. I am a Senior Creative Content Specialist for Invent Now, Inc.",2013-12-24,0.5,-0.5,1.0,0.5
